category_ids,category_names,sku,meta_title,meta_description,Image,manufacturer,description,short_description,summary,upc,size_info,meta_keyword
13|23901|28313,Generators|Portable Generators|Rental Portable Generators,5747,8000 Watt Generator,Premium quality power is just one advantage of this heavy duty generator engineered for high performance using the Generac OHVI engine.,E:\IMAGES\ITEMS\product\5\7\Generac-Power-System-INC-5747-8000-Watt.jpg,"Generac Power Systems, Inc.",Premium quality power is just one advantage of this heavy duty generator engineered for high performance using the Generac OHVI engine.,Electric start on 8000E for easy start up. Generac's OHVI™ engine was designed specifically for generators.  It out runs competitive generator engines with an engine life that is three to four times longer.,"Compact and Durable Construction with oversize full-wrap frame tubing and one of the best power-to-size rations on the market. Compact and durable construction with oversize full-wrap frame tubing and one of the best power-to-size rations on the market. Comprehensive, user-friendly control panel  includes engine controls (start/stop, fuel shut-off, choke), PowerBar™ watt meter, and LED illumination for easy, convenient operation. Low-Oil pressure protection to protect the engine from damage. Circuit breaker outlet protection including dual breakers on 120/240V outlets and GFCI protection on 120V outlets. Maintenance kit included. Plug-In Battery Charger to keep the battery charged and ready to go is included with electric start models.",,"Generac Power System, INC. 5747 8000 Watt Generator",8000 Watt Generator
13|23901|28313,Generators|Portable Generators|Rental Portable Generators,5939,5500 Watt Generator,"The GP550 is the perfect solution for tailgating, camping, power tool use—even emergency backup power.",E:\IMAGES\ITEMS\product\5\9\Generac-Power-System-INC-5939-5500-Watt.jpg,"Generac Power Systems, Inc.","The GP550 is the perfect solution for tailgating, camping, power tool use-even emergency backup power.","Compact Design provides unparalleled power-to-weight ratio. Covered, circuit breaker protected outlets provide added protection from the environment and rugged working conditions. Low oil shutdown prevents engine damage. Low-tone mufflers for quiet operation. Fuel gauge incorporated for at a glance fuel monitoring. Hour meter to track maintenance intervals. Ergonomic fold-down locking handle makes transport and storage easy.",,,"Generac Power System, INC. 5939 5500 Watt Generator",5500 Watt Generator
13|23901|28313,Generators|Portable Generators|Rental Portable Generators,5604 0,4000 Watt Generator,This compact yet rugged unit is easy to transport to job sites while still packing power with Generac’s OHVI® engine.,E:\IMAGES\ITEMS\product\5\6\Generac-Power-System-INC-5604-0-4000-Watt.jpg,"Generac Power Systems, Inc.",This compact yet rugged unit is easy to transport to job sites while still packing power with Generac's OHVI® engine.,Generac's OHVI™ engine was designed specifically for generators. It out runs competitive generator engines with an engine life that is three to four times longer and has a significantly longer period between scheduled maintenance checkups.,"Durable construction with oversized full-wrap frame tubing and impact resistant corners minimizes damage from rough handling. TruePower™ Technology provides clean, smooth operation of sensitive electronics and appliances. Low-Oil Pressure Protection to protect engine from damage. Covered Outlets for more protection from the environment. Start/Stop Fuel Shut-off and Choke Controls conveniently located on outlet panel. Circuit Breaker Outlet Protection including dual breakers on 120/240V outlets and GFCI protection. Cord Set included: 20' 20 Amp w/ 4 outlets. Maintenance Kit included.",,"Generac Power System, INC. 5604 0 4000 Watt Generator",4000 Watt Generator
13|23901|28313,Generators|Portable Generators|Rental Portable Generators,5605 0,6500 Watt Generator,Professional grade with rugged construction and premium features. Ideal for job sites and day long events.,E:\IMAGES\ITEMS\product\\\Generac-Power-System-INC-5605-0-6500-Watt.jpg,"Generac Power Systems, Inc.",Professional grade with rugged construction and premium features. Ideal for job sites and day long events.,Generac's OHVI™ engine was designed specifically for generators. It outruns competitive generator engines with an engine life that is three to four times longer and has a significantly longer period between scheduled maintenance checkups.,"Durable construction with oversized full-wrap frame tubing and impact resistant corners minimizes damage from rough handling. TruePower™ Technology provides clean, smooth operation of sensitive electronics and appliances. Low-Oil Pressure Protection to protect engine from damage. Covered Outlets for more protection from the environment. Start/Stop Fuel Shut-off and Choke Controls conveniently located on outlet panel. External Battery Charge Jack for added convenience. Circuit Breaker Outlet Protection including dual breakers on 120/240V outlets and GFCI protection. Cord Set included - 20' 30 Amp w/ 4 outlets. Maintenance kit included.",,"Generac Power System, INC. 5605 0 6500 Watt Generator",6500 Watt Generator
13|23901|28313,Generators|Portable Generators|Rental Portable Generators,5606 0,8000 Watt Generator,Professional grade with rugged construction and premium features. Ideal for job sites and day long events.,E:\IMAGES\ITEMS\product\5\6\Generac-Power-System-INC-5606-0-8000-Watt.jpg,"Generac Power Systems, Inc.",Professional grade with rugged construction and premium features. Ideal for job sites and day long events.,Generac's OHVI™ engine was designed specifically for generators. It outruns competitive generator engines with an engine life that is three to four times longer and has a significantly longer period between scheduled maintenance checkups.,"Durable construction with oversized full-wrap frame tubing and impact resistant corners minimizes damage from rough handling. TruePower™ Technology provides clean, smooth operation of sensitive electronics and appliances. Low-Oil Pressure Protection to protect engine from damage. Covered Outlets for more protection from the environment. Start/Stop Fuel Shut-off and Choke Controls conveniently located on outlet panel. External Battery Charge Jack for added convenience. Circuit Breaker Outlet Protection including dual breakers on 120/240V outlets and GFCI protection. Cord Set included - 20' 30 Amp w/ 4 outlets. Maintenance Kit included.",,"Generac Power System, INC. 5606 0 8000 Watt Generator",8000 Watt Generator
13|23901|28313,Generators|Portable Generators|Rental Portable Generators,5623 0,6500 Watt Generator with wheel kit,"An affordable solution for many different applications, the GP6500 (pull start) and GP6500E (electric start) are ideal for tailgating, camping, power tool use, and emergency home backup power.",E:\IMAGES\ITEMS\product\5\6\Generac-Power-System-INC-5623-0-6500-Watt-Generator-with.jpg,"Generac Power Systems, Inc.","An affordable solution for many different applications, the GP6500 (pull start) and GP6500E (electric start) are ideal for tailgating, camping, power tool use, and emergency home backup power.","Covered, circuit breaker protected outlets provide added protection from the environment and rugged working conditions. Electric start on GP6500E with recoil backup. Battery included. Low oil shutdown prevents engine damage. Low-tone mufflers for quiet operation. Fuel gauge incorporated for at a glance fuel monitoring. Hour meter to track maintenance intervals. Fold down handle and never-flat wheels for portability.",,,"Generac Power System, INC. 5623 0 6500 Watt Generator with wheel kit",6500 Watt Generator with wheel kit
13,Generators,EcoGen,Ecogen 6 KW Generator,"Designed specifically to interact with off-grid renewable energy applications, the EcoGen 6 kW is the first generator intended for alternative energy system standby power. It’s engineered to easily integrate into an inverter and battery storage system,",E:\IMAGES\ITEMS\product\E\c\Generac-Ecogen-6.jpg,"Generac Power Systems, Inc.","Designed specifically to interact with off-grid renewable energy applications, the EcoGen 6 kW is the first generator intended for alternative energy system standby power. It's engineered to easily integrate into an inverter and battery storage system, providing a cleaner running, low emission solution for recharging battery banks in an off-grid application.","Extended run capability & long life are gained from our exclusive premium oil recovery and circulation system that virtually halts oil degradation. Maintenance intervals are extended by an unprecedented five times the industry standard with 500 hours between oil changes. Clean burning propane fuel increases efficiency, contributes to longer engine life, and produces significantly less carbon monoxide than gasoline fueled engines. Weather protective steel enclosure features our RhinoCoat™ finish system, providing exceptional protection from the elements on not only the enclosure, but also the base frame. Warranty - backed by an unprecedented 3 year/2000 hour limited warranty when used off-grid in an alternative energy system. NexusTM Digital Controller features an LCD display with status indicators, monitors generator performance, and also records any issues for easy troubleshooting. Integrated smart charging system only charges the battery when necessary. Three position switch allows for automatic, off and manual functions. Capable of 120V or 240V - factory wired for a full 6 kW at 120VAC, with the capability to be reconfigured for a full 6 kW output at 240VAC to accommodate larger 240V inverter systems or two systems paired together. Factory equipped with two-wire start to easily connect to the inverter control wires. It enables the inverter to automatically start and stop the generator in order to charge the system batteries as necessary. Ultra quiet, low rpms - only 52 dB(A) under normal load! Vertically mounted, belt-driven engine drives at 2600 RPMs, resulting in a longer life and drastically quieter operation than other systems.",,,Generac Ecogen 6 kw,Ecogen 6 KW Generator
13,Generators,Corepower System,7 KW Corepower Generator,"Generac's new 7kW CorePowerTM  Series standby generator is a complete generator and transfer switch system, priced more affordably than any other system in the market. It makes choosing an automatic generator over a portable the obvious choice to manage p",E:\IMAGES\ITEMS\product\C\o\Generac-Corepower-System-7.jpg,"Generac Power Systems, Inc.","Generac's new 7kW CorePowerTM  Series standby generator is a complete generator and transfer switch system, priced more affordably than any other system in the market. It makes choosing an automatic generator over a portable the obvious choice to manage power outages. The compact design is engineered for easy maintenance and serviceability, and is ideal when space is at a premium.","Prepackaged system  - 7 kW standby generator is prepackaged with a 50 Amp transfer switch with eight circuit load center including breakers Generac OHV engine is designed for reliability and long life At least 10 dB(A) quieter than competitive units and significantly quieter than a standard portable generator  Easy installation and maintenance - sides are quickly removed without tools for easy accessibility during initial installation and ongoing maintenance. Digital controller with LED status and fault indicators All-weather composite enclosure withstands the harshest environments, including coastal areas  Lightweight and compact - lighter than comparable units so placement is easier and compact footprint fits in tight spaces",,,Generac Corepower System 7 kw,7 KW Corepower Generator
13,Generators,Guardian Series,guardian Series 8 kw,"Provides essential circuit power protection for your home, ensuring the necessities remain powered during an outage. The most affordable automatic standby generator on the market offers protection for half the cost of central air conditioning.",E:\IMAGES\ITEMS\product\G\u\Generac-guardian-Series-8.jpg,"Generac Power Systems, Inc.","Provides essential circuit power protection for your home, ensuring the necessities remain powered during an outage. The most affordable automatic standby generator on the market offers protection for half the cost of central air conditioning.","Generac's Nexus™ Controller is the most comprehensive available. The dual line, tri-lingual LCD display in English, Spanish, and French allows for easy monitoring and management of generator functions. Simple field conversion from natural gas to LP. Generac's OHVI® engine  was designed specifically for generators. It outperforms most competitive generator engines with an engine life that is three to four times longer and has a significantly longer period between scheduled maintenance checkups. TruePower™ Technology provides clean, smooth operation of sensitive electronics and appliances. Sturdy, galvanneal steel enclosure with RhinoCoat™ finish for superior weather protection, modeled to withstand 150 mph winds. External ""At-a-Glance"" indicator lights offer an easy way to tell generator status without opening the generator enclosure. Added Sound Reduction with enclosures that are lined with sound reducing foam panels for further noise reduction.  Hour Meter monitors run time, providing information to determine maintenance intervals. Easiest installation on the market and an excellent value when purchased pre-packaged with a pre-wired transfer switch, or customize your system by purchasing the generator and transfer switch separately. Composite mounting pad is included, eliminating the need to pour a concrete base.",,,Generac guardian Series 8 kw,guardian Series 8 kw
13,Generators,Guardian Series 10 kw,Guardian Series 10 kw,"Provides essential circuit power protection for your home, ensuring the necessities remain powered during an outage. Has the ability to backup a 3-ton air conditioner, well pump or water heater, and the main rooms of your house.",E:\IMAGES\ITEMS\product\G\u\Generac-Guardian-Series-10.jpg,"Generac Power Systems, Inc.","Provides essential circuit power protection for your home, ensuring the necessities remain powered during an outage. Has the ability to backup a 3-ton air conditioner, well pump or water heater, and the main rooms of your house.","Generac's Nexus™ Controller is the most comprehensive available. The dual line, tri-lingual LCD display in English, Spanish, and French allows for easy monitoring and management of generator functions. Simple field conversion from natural gas to LP. Generac's OHVI® engine  was designed specifically for generators. It outperforms most competitive generator engines with an engine life that is three to four times longer and has a significantly longer period between scheduled maintenance checkups. TruePower™ Technology provides clean, smooth operation of sensitive electronics and appliances. Sturdy, galvanneal steel enclosure with RhinoCoat™ finish for superior weather protection, modeled to withstand 150 mph winds. External ""At-a-Glance"" indicator lights offer an easy way to tell generator status without opening the generator enclosure. Added Sound Reduction with enclosures that are lined with sound reducing foam panels for further noise reduction. Hour Meter monitors run time, providing information to determine maintenance intervals.  Easiest installation on the market and an excellent value when purchased pre-packaged with a pre-wired transfer switch, or customize your system by purchasing the generator and transfer switch separately.Composite mounting pad is included, eliminating the need to pour a concrete base.",,,Generac Guardian Series 10 kw,Guardian Series 10 kw
91,Generators > 10Kw,Guardian Series 14 kw,Guardian Series 14 kw,"Provides essential circuit power protection for your home, ensuring the necessities remain powered during an outage. This unit is powerful enough to backup a 4 or 5 ton air conditioner in addition to your home office, garage or additional bedrooms or bath",E:\IMAGES\ITEMS\product\G\u\Generac-Guardian-Series-14.jpg,"Generac Power Systems, Inc.","Provides essential circuit power protection for your home, ensuring the necessities remain powered during an outage. This unit is powerful enough to backup a 4 or 5 ton air conditioner in addition to your home office, garage or additional bedrooms or baths.","Generac's Nexus™ Controller is the most comprehensive available. The dual line, tri-lingual LCD display in English, Spanish, and French allows for easy monitoring and management of generator functions. Simple field conversion from natural gas to LP. Generac's OHVI® engine  was designed specifically for generators. It outperforms most competitive generator engines with an engine life that is three to four times longer and has a significantly longer period between scheduled maintenance checkups. TruePower™ Technology provides clean, smooth operation of sensitive electronics and appliances. Sturdy, galvanneal steel enclosure with RhinoCoat™ finish for superior weather protection, modeled to withstand 150 mph winds. External ""At-a-Glance"" indicator lights offer an easy way to tell generator status without opening the generator enclosure. Added Sound Reduction with enclosures that are lined with sound reducing foam panels for further noise reduction.  Hour Meter monitors run time, providing information to determine maintenance intervals.  Easiest installation on the market and an excellent value when purchased pre-packaged with a pre-wired transfer switch, or customize your system by purchasing the generator and transfer switch separately.Composite mounting pad is included, eliminating the need to pour a concrete base.",,,Generac Guardian Series 14 kw,Guardian Series 14 kw
13|23901,Generators|Portable Generators,GP Series 1800 Watt,GP Series 1800 Watt,"An affordable solution for recreation applications. Perfect size for tailgating,camping and power tool use.",E:\IMAGES\ITEMS\product\G\P\Generac-GP-Series-1800.jpg,"Generac Power Systems, Inc.","An affordable solution for recreation applications. Perfect size for tailgating,camping and power tool use.",Low oil shutdown prevents engine damage. Low-tone mufflers for quiet operation. Fuel gauge incorporated for at a glance fuel monitoring. Circuit breaker protected outlets protect against circuit overload. CSA certified.,,,Generac GP Series 1800 Watt,GP Series 1800 Watt
13|23901,Generators|Portable Generators,GP Series 3250 Watt,3250 Watt Generator,"An affordable solution for recreational applications. Perfect size for tailgating,camping and power tool use.",E:\IMAGES\ITEMS\product\G\P\Generac-GP-Series-3250.jpg,"Generac Power Systems, Inc.","An affordable solution for recreational applications. Perfect size for tailgating,camping and power tool use.",Low oil shutdown prevents engine damage. Low-tone mufflers for quiet operation. Fuel gauge incorporated for at a glance fuel monitoring. Circuit breaker protected outlets protect against circuit overload. Fold down handles and never-flat wheels for portability. CSA certified.,,,Generac GP Series 3250 Watt,3250 Watt Generator
13|23901,Generators|Portable Generators,GP Series 5500 Watt,GP Series 550 Watt Generator,"The GP550 is the perfect solution for tailgating, camping, power tool use—even emergency backup power.",E:\IMAGES\ITEMS\product\G\P\Generac-GP-Series-550.jpg,"Generac Power Systems, Inc.","The GP550 is the perfect solution for tailgating, camping, power tool use-even emergency backup power.","Compact design provides unparalleled power-to-weight ratio. Covered, circuit breaker protected outlets provide added protection from the environment and rugged working conditions. Low oil shutdown prevents engine damage. Low-tone mufflers for quiet operation. Fuel gauge incorporated for at a glance fuel monitoring. Hour meter to track maintenance intervals. Ergonomic fold-down locking handle makes transport and storage easy.",,,Generac GP Series 550 Watt,GP Series 550 Watt Generator
13|23901,Generators|Portable Generators,iX800,iX800 Series Portable Generator,"Generac's iX Series inverter technology takes the raw power produced by the generator and passes it through a special electronic microprocessor to provide clean and stable power, safe for computers and other sensitive electronic devices.",E:\IMAGES\ITEMS\product\i\X\Generac-iX800-Portable.jpg,"Generac Power Systems, Inc.","Generac's iX Series inverter technology takes the raw power produced by the generator and passes it through a special electronic microprocessor to provide clean and stable power, safe for computers and other sensitive electronic devices.",800 Wattsof clean power to safely power sensitive electronics Electronic Circut Breakersprotect against overloads Low Oil Shutdownprotection prevents engine from damage FlexPowerTMto save fuel and reduce noise Super Compactand quiet ControlPanel Indicator Lights Run Timeat 50% load for 3.6 hours,,,Generac iX800 Portable Generator,iX800 Series Portable Generator
13|23901,Generators|Portable Generators,iX1400,iX Series Poratable Generator,"Generac's iX Series inverter technology takes the raw power produced by the generator and passes it through a special electronic microprocessor to provide clean and stable power, safe for computers and other sensitive electronic devices.",E:\IMAGES\ITEMS\product\i\X\Generac-iX1400-Poratable.jpg,"Generac Power Systems, Inc.","Generac's iX Series inverter technology takes the raw power produced by the generator and passes it through a special electronic microprocessor to provide clean and stable power, safe for computers and other sensitive electronic devices.",1400 Watts of clean power to safely power sensitive electronics Electronic Circuit Breakers protect against overloads low Oil Shutdown protection protects engine from damage FlexPower to save fuel and reduce noise 12V DC charging outlet Control Panel Indicator Run Time at 50% load for 5 hours,,,Generac iX1400 Poratable Generator,iX Series Poratable Generator
13|23901,Generators|Portable Generators,iX1600,iX1600 Series Portable Generator,"Generac's iX Series inverter technology takes the raw power produced by the generator and passes it through a special electronic microprocessor to provide clean and stable power, safe for computers and other sensitive electronic devices.",E:\IMAGES\ITEMS\product\i\X\Generac-iX1600-Portable.jpg,"Generac Power Systems, Inc.","Generac's iX Series inverter technology takes the raw power produced by the generator and passes it through a special electronic microprocessor to provide clean and stable power, safe for computers and other sensitive electronic devices.",1600 Watts of clean power to safely power sensitive electronics Electronic Circuit Breakers protect against overloads Low Oil Shutdown protection protects engine from damage FlexPower to save fuel and reduce noise 12V DC charging outlet Control Panel Indicator Run Time at 50% load for 4.9 hours,,,Generac iX1600 Portable Generator,iX1600 Series Portable Generator
13|23901,Generators|Portable Generators,iX2000,iX2000 Series Portable Generator,"Generac's iX Series inverter technology takes the raw power produced by the generator and passes it through a special electronic microprocessor to provide clean and stable power, safe for computers and other sensitive electronic devices.",E:\IMAGES\ITEMS\product\i\X\Generac-iX2000-Portable.jpg,"Generac Power Systems, Inc.","Generac's iX Series inverter technology takes the raw power produced by the generator and passes it through a special electronic microprocessor to provide clean and stable power, safe for computers and other sensitive electronic devices.",2000 Watts of clean power to safely power sensitive electronics Electronic Circuit Breaker protect against overload Low Oil Shutdown protection prevent engine from damage FlexPower to save fuel and reduce noise 12V DC charging outlet Control Panel Indicator Lights Run Time at 50% load 4.7 hours,,,Generac iX2000 Portable Generator,iX2000 Series Portable Generator
684|23966,Pressure Washers|Gas Pressure Washers,3100PSI,3100PSI Power Washer (2.8 GPM),"With a powerful Generac OHV horizontal shaft engine and professional-grade triplex pump, this 3100PSI power washer is just right for cleaning around the house, at work, or on the farm.",E:\IMAGES\ITEMS\product\3\1\3100PSI-Power-Washer-28.jpg,"Generac Power Systems, Inc.","With a powerful Generac OHV horizontal shaft engine and professional-grade triplex pump, this 3100PSI power washer is just right for cleaning around the house, at work, or on the farm.","Professional grade triplex pump Professional grade spray gun Quick-Click nozzle tips 10"" Never Flat wheels Large 212cc Generac OHV horizontal shaft engine 3/8"" x 35' steel-reinforced rubber hose Durable welded roll-cage style frame",,,3100PSI Power Washer (2.8 GPM),3100PSI Power Washer (2.8 GPM)
23901,Portable Generators,5819,GENERAC 5819 26R WET CELL BATTERY,,E:\IMAGES\ITEMS\product\5\8\generac-power-systems-inc-5819-generac-5819-26r-wet-cell-battery.jpg,"Generac Power Systems, Inc.",,,"Every standby geneator requires a battery to start the system. In efforts to acheive the easiest generator installation. Generac offers the recommended 26R, wet cell battery applicaable for virtually all residential Generac standby generators",69647105819.0,,GENERAC 5819 26R WET CELL BATTERY
