category_ids,category_names,sku,meta_title,meta_description,Image,manufacturer,description,short_description,summary,upc,size_info,meta_keyword
13|23901|28313,Generators|Portable Generators|Rental Portable Generators,EU2000i,Home Back Up Generator,Honda EU2000i Home Back Up Generator,E:\IMAGES\ITEMS\product\E\U\Honda-EU2000i-Home-Back-Up.jpg,Honda,Honda EU2000i Home Back Up Generator,"2000 watts, 120V Ideal for TV/DVD, satellite, fridge, coffee pot, and more Super quiet Easy to carry - less than 47 lbs!! Fuel efficient - up to 9.6 hrs on 1 gal of gas Inverter - stable power for computers and more","Honda Generators are the perfect choice for home back up power: Reliable, quiet power Long run times Easy transporting Convenient and easy to use Choose from our deluxe EM series models and our super-quiet EU series for the ultimate in portable home power.",,Honda EU2000i Home Back Up Generator,Home Back Up Generator
13|23901|28313,Generators|Portable Generators|Rental Portable Generators,EU2000i Camo,Back-up Home Generator,Honda EU2000i Camo Back-up Home Generator,E:\IMAGES\ITEMS\product\E\U\Honda-EU2000i-Camo-Back-up-Home.jpg,Honda,Honda EU2000i Camo Back-up Home Generator,"2000 watts, 120V Natural Gear™ camo exterior Ideal for TV/DVD, satellite, fridge, coffee pot, and more Super quiet Fuel efficient - up to 9.6 hrs on 1 gal of gas Inverter - stable power for computers and more","Honda Generators are the perfect choice for home back up power: Reliable, quiet power Long run times Easy transporting Convenient and easy to use Choose from our deluxe EM series models and our super-quiet EU series for the ultimate in portable home power.",,Honda EU2000i Camo Back-up Home Generator,Back-up Home Generator
13|23901|28313,Generators|Portable Generators|Rental Portable Generators,EU2000i Companion,Home Back-up Generator,Honda EU2000i Companion Home Back-up Generator,E:\IMAGES\ITEMS\product\E\U\Honda-EU2000i-Companion-Home-Back-up.jpg,Honda,Honda EU2000i Companion Home Back-up Generator,"2000 watts, 120V Built in 30A outlet for easy parallel capability with another EU2000i Ideal for TV/DVD, satellite, fridge, coffee pot, and more Great for RV applications Super quiet Inverter - stable power for computers and more","Honda Generators are the perfect choice for home back up power: Reliable, quiet power Long run times Easy transporting Convenient and easy to use Choose from our deluxe EM series models and our super-quiet EU series for the ultimate in portable home power.",,Honda EU2000i Companion Home Back-up Generator,Home Back-up Generator
13|23901|28313,Generators|Portable Generators|Rental Portable Generators,EU3000i Handi,Home Back-up Generator,Honda EU3000i Handi Home Back-up Generator,E:\IMAGES\ITEMS\product\E\U\Honda-EU3000i-Handi-Home-Back-up.jpg,Honda,Honda EU3000i Handi Home Back-up Generator,The lightest 3000-watt inverter generator we've ever made Wheels and folding handle for true portability Compact design Offset handles for easier lifting Recessed convenience light,"Honda Generators are the perfect choice for home back up power: Reliable, quiet power Long run times Easy transporting Convenient and easy to use Choose from our deluxe EM series models and our super-quiet EU series for the ultimate in portable home power.",,Honda EU3000i Handi Home Back-up Generator,Home Back-up Generator
13|23901|28313,Generators|Portable Generators|Rental Portable Generators,EU3000iS,Home Back-up Generator,Honda EU3000iS Home Back-up Generator,E:\IMAGES\ITEMS\product\E\U\Honda-EU3000iS-Home-Back-up.jpg,Honda,Honda EU3000iS Home Back-up Generator,"3000 watts, 120V Power for your furnace, fridge, microwave, most 13,500 BTU RV AC units, and more Super quiet Convenient electric start Fuel efficient - up to 20 hrs on 3.4 gals of gas Inverter - stable power for computers and more","Honda Generators are the perfect choice for home back up power: Reliable, quiet power Long run times Easy transporting Convenient and easy to use Choose from our deluxe EM series models and our super-quiet EU series for the ultimate in portable home power.",,Honda EU3000iS Home Back-up Generator,Home Back-up Generator
13|23901|28313,Generators|Portable Generators|Rental Portable Generators,EU6500iS,Home Back-up Generator,"Honda EU6500iS Home Back-up Generator, EU6500iSAN, EU6500iSAC",E:\IMAGES\ITEMS\product\E\U\Honda-EU6500iS-Home-Back-up.jpg,Honda,Honda EU6500iS Home Back-up Generator,"6500 watts, 120/240V Perfect for home back up power, RV's, outdoor events, job sites, and more Super quiet Fuel efficient - up to 14 hrs on 4.5 gals of gas Convenient electric start Inverter - stable power for computers and more","Honda Generators are the perfect choice for home back up power: Reliable, quiet power Long run times Easy transporting Convenient and easy to use Choose from our deluxe EM series models and our super-quiet EU series for the ultimate in portable home power.",,Honda EU6500iS Home Back-up Generator,Home Back-up Generator
13|23901|28313,Generators|Portable Generators|Rental Portable Generators,EM4000S,Home Back-up Generator,Honda EM4000S Home Back-up Generator,E:\IMAGES\ITEMS\product\E\M\Honda-EM4000S-Home-Back-up.jpg,Honda,Honda EM4000S Home Back-up Generator,"4000 watts 120/240V Provides 5,000 watts for 10 secs to start larger equipment Powers fridge, furnace, lights, TV, and much more Long run time - up to 16 hrs Powerful Honda iGX commercial engine Electric start (battery included) with recoil back-up","Honda Generators are the perfect choice for home back up power: Reliable, quiet power Long run times Easy transporting Convenient and easy to use Choose from our deluxe EM series models and our super-quiet EU series for the ultimate in portable home power.",,Honda EM4000S Home Back-up Generator,Home Back-up Generator
13|23901|28313,Generators|Portable Generators|Rental Portable Generators,EM5000iS,Home Back-up Generator,Honda EM5000iS Home Back-up Generator,E:\IMAGES\ITEMS\product\E\M\Honda-EM5000iS-Home-Back-up.jpg,Honda,Honda EM5000iS Home Back-up Generator,"5000 watts, 120/240V Powers fridge, furnace, well pump, and much more Inverter - stable power for computers and more Standard electric start with remote start capability 2 wheel kit - easy to transport Powerful Honda commercial OHV engine","Honda Generators are the perfect choice for home back up power: Reliable, quiet power Long run times Easy transporting Convenient and easy to use Choose from our deluxe EM series models and our super-quiet EU series for the ultimate in portable home power.",,Honda EM5000iS Home Back-up Generator,Home Back-up Generator
13|23901|28313,Generators|Portable Generators|Rental Portable Generators,EM5000S,Home Back-up Generator,Honda EM5000S Home Back-up Generator,E:\IMAGES\ITEMS\product\E\M\Honda-EM5000S-Home-Back-up.jpg,Honda,Honda EM5000S Home Back-up Generator,"5000 watts 120/240V Provides 7,000 watts for 10 secs to start larger equipment Powers fridge, furnace, well pump, and much more Long run time - up to 11.2 hrs Powerful Honda iGX commercial engine Electric start (battery included) with recoil back-up","Honda Generators are the perfect choice for home back up power: Reliable, quiet power Long run times Easy transporting Convenient and easy to use Choose from our deluxe EM series models and our super-quiet EU series for the ultimate in portable home power.",,Honda EM5000S Home Back-up Generator,Home Back-up Generator
13|23901|28313,Generators|Portable Generators|Rental Portable Generators,EM6500S,Home Back-up Generator,Honda EM6500S Home Back-up Generator,E:\IMAGES\ITEMS\product\E\M\Honda-EM6500S-Home-Back-up.jpg,Honda,Honda EM6500S Home Back-up Generator,"6500 watts 120/240V Provides 7,000 watts for 10 secs to start larger equipment Powers fridge, freezer, furnace, well pump, and much more Long run time - up to 10.4 hrs Powerful Honda iGX commercial engine Electric start (battery included) with recoil back-up","Honda Generators are the perfect choice for home back up power: Reliable, quiet power Long run times Easy transporting Convenient and easy to use Choose from our deluxe EM series models and our super-quiet EU series for the ultimate in portable home power.",,Honda EM6500S Home Back-up Generator,Home Back-up Generator
13|23901|28313,Generators|Portable Generators|Rental Portable Generators,EB3000c,Industrial Generator,"Honda EB3000c Industrial Generator, EB3000CKAN, EB3000CKAC, EB3000CKAG",E:\IMAGES\ITEMS\product\E\B\Honda-EB3000c-Industrial.jpg,Honda,Honda EB3000c Industrial Generator,"3000 watts, 120V Lightweight - only 68 lbs. Honda commercial OHV engine Exclusive CycloConverter technology GFCI receptacle 12V DC charging",Full frame protection GFCI protected outlets OSHA compliant Reliable voltage regulation Long run times Easy transport and storage,,Honda EB3000c Industrial Generator,Industrial Generator
13|23901|28313,Generators|Portable Generators|Rental Portable Generators,EB4000,Industrial Generator,"Honda EB4000 Industrial Generator, EB4000X",E:\IMAGES\ITEMS\product\E\B\Honda-EB4000-Industrial.jpg,Honda,Honda EB4000 Industrial Generator,"4000 watts, 120/240V Provides 5,000 watts for 10 secs to start larger equipment Honda commercial iGX engine & heavy duty frame Full GFCI protection Long run time - up to 16 hrs 120/240V selector switch 2 wheel kit & lift hook",Full frame protection GFCI protected outlets OSHA compliant Reliable voltage regulation Long run times Easy transport and storage,,Honda EB4000 Industrial Generator,Industrial Generator
13|23901|28313,Generators|Portable Generators|Rental Portable Generators,EB5000,Industrial Generator,"Honda EB5000 Industrial Generator, EB5000XK3",E:\IMAGES\ITEMS\product\E\B\Honda-EB5000-Industrial.jpg,Honda,Honda EB5000 Industrial Generator,"5000 watts, 120/240V Provides 7,000 watts for 10 secs to start larger equipment Honda commercial iGX engine & heavy duty frame Full GFCI protection Long run time - up to 11.2 hrs 120/240V selector switch 2 wheel kit & lift hook",Full frame protection GFCI protected outlets OSHA compliant Reliable voltage regulation Long run times Easy transport and storage,,Honda EB5000 Industrial Generator,Industrial Generator
13|23901|28313,Generators|Portable Generators|Rental Portable Generators,EB6500,Industrial Generator,"Honda EB6500 Industrial Generator, EB6500X1",E:\IMAGES\ITEMS\product\E\B\Honda-EB6500-Industrial.jpg,Honda,Honda EB6500 Industrial Generator,"6500 watts, 120/240V Provides 7,000 watts for 10 secs to start larger equipment Honda commercial iGX engine & heavy duty frame Full GFCI protection Long run time - up to 10.4 hrs 120/240V selector switch 2 wheel kit & lift hook",Full frame protection GFCI protected outlets OSHA compliant Reliable voltage regulation Long run times Easy transport and storage,,Honda EB6500 Industrial Generator,Industrial Generator
13|23901|28313,Generators|Portable Generators|Rental Portable Generators,EU1000i,Recreational Generator,"Honda EU1000i Recreational Generator, EU1000IKN, EU1000IKC, EU1000iAN, EU1000iAC",E:\IMAGES\ITEMS\product\E\U\Honda-EU1000i-Recreational.jpg,Honda,Honda EU1000i Recreational Generator,"1000 watts, 120V Ideal for TV, lights, fans, small power tools and more Super quiet Less than 29 lbs!! Fuel efficient - up to 8.3 hrs on 0.6 gal of gas Inverter - stable power for computers and more",Super quiet Fuel efficient Lightweight and easy to transport Larger models are also great for home back up power,,Honda EU1000i Recreational Generator,Recreational Generator
13|23901|28313,Generators|Portable Generators|Rental Portable Generators,EP2500,Recreational Generator,"Honda EP2500 Recreational Generator, EP2500X1AH, EP25001ACH",E:\IMAGES\ITEMS\product\E\P\Honda-EP2500-Recreational.jpg,Honda,Honda EP2500 Recreational Generator,"2500 watts, 120V Honda commercial OHV engine AVR for stable power Long run time - up to 15.3 hrs Full frame protection",Super quiet Fuel efficient Lightweight and easy to transport Larger models are also great for home back up power,,Honda EP2500 Recreational Generator,Recreational Generator
13|23901|28313,Generators|Portable Generators|Rental Portable Generators,EG4000,Recreational Generator,Honda EG4000 Recreational Generator,E:\IMAGES\ITEMS\product\E\G\Honda-EG4000-Recreational.jpg,Honda,Honda EG4000 Recreational Generator,"4000 watts, 120/240V Economic, portable power Honda commercial OHV engine Honda-exclusive DAVR (Digital Auto Voltage Regulation) Full frame protection Voltage Selector Switch - 120/240V operation",Super quiet Fuel efficient Lightweight and easy to transport Larger models are also great for home back up power,,Honda EG4000 Recreational Generator,Recreational Generator
13|23901|28313,Generators|Portable Generators|Rental Portable Generators,EG5000,Recreational Generator,"Honda EG5000 Recreational Generator , EG5000CLAT",E:\IMAGES\ITEMS\product\E\G\Honda-EG5000-Recreational.jpg,Honda,Honda EG5000 Recreational Generator,"5000 watts, 120/240V Economic, portable power Honda commercial OHV engine Honda-exclusive DAVR (Digital Auto Voltage Regulation) Full frame protection Voltage Selector Switch - 120/240V operation",Super quiet Fuel efficient Lightweight and easy to transport Larger models are also great for home back up power,,Honda EG5000 Recreational Generator,Recreational Generator
13|23901|28313,Generators|Portable Generators|Rental Portable Generators,EG6500,Recreational Generator,"Honda EG6500 Recreational Generator, EG6500CLAT",E:\IMAGES\ITEMS\product\E\G\Honda-EG6500-Recreational.jpg,Honda,Honda EG6500 Recreational Generator,"6500 watts, 120/240V Economic, portable power Honda commercial OHV engine Honda-exclusive DAVR (Digital Auto Voltage Regulation) Full frame protection Voltage Selector Switch - 120/240V operation",Super quiet Fuel efficient Lightweight and easy to transport Larger models are also great for home back up power,,Honda EG6500 Recreational Generator,Recreational Generator
23952|28282,Lawn Mowers|Rental Lawn Landscaping Equipment,HRC216PDA,Push Mower,"Honda HRC216PDA Push Mower, HRC2163PDA, HRC216K3PDA",E:\IMAGES\ITEMS\product\H\R\Honda-HRC216PDA-Push.jpg,Honda,Honda HRC216PDA Push Mower,"21"" commercial rear bagger/mulcher Push type Easy to start commercial 160cc engine MicroCut™ Twin Blades Front bumper and edge guards to protect deck","Push propelled rear bagger/mulcher Honda commercial-grade GSV160 OHV/OHC 4-stroke engine MicroCut™ twin blade system - four cutting surfaces for finer clippings 21"" heavy duty steel deck is rugged and built to last Front bumper and edge guards to protect deck Heavy-duty reinforced handles 8 mowing heights (3/4 - 4"") Large 9"" Nexite® wheels Ball bearings in all four wheels Large capacity fuel tank Large, 2.5 bushel easy-empty grass bag Zone start safety system Manual fuel shut-off valve 1 year commercial warranty (2 years engine)",,Honda HRC216PDA Push Mower,Push Mower
23980|28282,Cultivators and Tillers|Rental Lawn Landscaping Equipment,FC600,Tiller,"Honda FC600 Tiller, FC600AN, FC600AC",E:\IMAGES\ITEMS\product\F\C\Honda-FC600.jpg,Honda,Honda FC600 Tiller,"Easy starting Honda commercial OHV engine 26.4"" tilling width 13"" tine diameter Easy-to-use adjustable drag bar Standard transport wheel 3 position adjustable handle","Easy starting Honda commercial OHV engine 26.4"" tilling width 13"" tine diameter Easy-to-use adjustable drag bar Protective front engine guard Simple ""one touch"" swing up transport wheel Reinforced handlebar Tine seal shaft protection Reinforced ""engine bed"" Dual element air cleaner Reinforced fender protects belt and increases durability Commercial grade fuel cap and filter Tine axle seal guards Meets all EPA emission requirements Corrosion-resistant muffler 3 year residential/commercial warranty",,Honda FC600 Tiller,Tiller
23980|28282,Cultivators and Tillers|Rental Lawn Landscaping Equipment,FRC800,Rear Tine Tiller,"Honda FRC800 Rear Tine Tiller, FRC800AN, FRC800AC",E:\IMAGES\ITEMS\product\F\R\Honda-FRC800-Rear-Tine.jpg,Honda,Honda FRC800 Rear Tine Tiller,"Easy starting Honda commercial OHV engine 20"" tilling width 12"" tine diameter Convenient ""loop handle"" design allows operation from either side Self propelled - 3 forward speeds, 1 reverse Commercial grade construction","Easy starting Honda commercial OHV engine 20"" tilling width, 12"" tine diameter Convenient ""loop handle"" design allows operation from either side Self propelled - 3 forward speeds, 1 reverse Meets all EPA emission requirements Commercial grade construction Heavy duty rear debris shield Honda Cyclone air filter 4-position handlebar 3 year residential/commercial warranty Protective front guard standard Unique tine design for smooth operation Adjustable drag bar Side tine shields standard",,Honda FRC800 Rear Tine Tiller,Rear Tine Tiller
979|24009|28325,Snow Blowers|Snow Blowers|Rental Snow Blowing Equipment,HS520A,Gas Snow Blower,Honda HS520A Gas Snow Blower,E:\IMAGES\ITEMS\product\H\S\Honda-HS520A-Gas-Snow.jpg,Honda,Honda HS520A Gas Snow Blower,"Easy start Honda OHC engine 4-stroke - no smell, no smoke Light and maneuverable Large 20"" wide clearing width, 12"" high Clears up to 50 tons/hour Semi-self propelled auger drive","Features: Runs over 1.6 hours on one tank of fuel Throws snow up to 26 Feet Large 20"" wide clearing width, 12"" high Easy-to use chute direction control Operator-friendly controls with large on/off switch Large fuel tank cap Easy-access spark plug and fuel drain Metal auger housing Meets all EPA and CARB emission standards 2 year residential warranty",,Honda HS520A Gas Snow Blower,Gas Snow Blower
979|24009|28325,Snow Blowers|Snow Blowers|Rental Snow Blowing Equipment,HS928WA,Gas Snow Blower,"Honda HS928WA Gas Snow Blower, HS928KWA",E:\IMAGES\ITEMS\product\H\S\Honda-HS928WA-Gas-Snow.jpg,Honda,Honda HS928WA Gas Snow Blower,"Clears up to 50 tons/hr Honda OHV commercial grade engine Self propelled, infinitely variable speed control hydrostatic drivetrain 28"" clearing width, 20"" clearing height Wheel drive Reversible two position skid shoes for long life Automatic decompression for easy starting Adjustable snow deflection A single lever accurately adjusts ground speed without affecting auger rotation speed Ice breaking serrated auger 210° adjustable discharge chute easily controlled from operating position Durable 2-ply tires Interconnected drive/auger Convenient control levers Metal auger housing Built in icing guard prevents icing in carburetor Standard work light Taller fuel cap makes it easy to grip with gloves","Honda's HS928 two-stage snowblower is the ultimate snow-clearing machines. These heavy duty models are ideal for situations where a more aggressive model is needed, like large areas, heavy snow, or commercial use.",,Honda HS928WA Gas Snow Blower,Gas Snow Blower
979|24009|28325,Snow Blowers|Snow Blowers|Rental Snow Blowing Equipment,HS928TA,Gas Snow Blower,Honda HS928TA Gas Snow Blower,E:\IMAGES\ITEMS\product\H\S\Honda-HS928TA-Gas-Snow.jpg,Honda,Honda HS928TA Gas Snow Blower,"Pedal-adjustable auger height Clears up to 50 tons/hr Honda OHV commercial grade engine Track drive - best traction available Pliable, low temperature rubber tracks with sure-gripping cleats, providing solid traction and ideal balance Self propelled, infinitely variable speed control hydrostatic drivetrain 28"" clearing width, 20"" clearing height Reversible two position skid shoes for long life Automatic decompression for easy starting Adjustable snow deflection A single lever accurately adjusts ground speed without affecting auger rotation speed Ice breaking serrated auger 210° adjustable discharge chute easily controlled from operating position Interconnected drive/auger Convenient control levers Metal auger housing Built in icing guard prevents icing in carburetor Standard work light Taller fuel cap makes it easy to grip with gloves","Honda's HS928 two-stage snowblower is the ultimate snow-clearing machines. These heavy duty models are ideal for situations where a more aggressive model is needed, like large areas, heavy snow, or commercial use.",,Honda HS928TA Gas Snow Blower,Gas Snow Blower
19954,Lighting Controls and Control Systems,06610-Z22-800ZA,CONTROL KIT *NH105*,,E:\IMAGES\ITEMS\product\0\6\honda-06610-z22-800za-control-kit-nh105.jpg,Honda,,,"Honda 06610-Z22-800ZA CONTROL KIT, REMOTE (10M) *NH105* (MAT BLACK) | (Optional).",,,CONTROL KIT *NH105*
28255,Engine Oil Drain Plugs,08213-10W30,ENGINE OIL 12OZ 10W30,,E:\IMAGES\ITEMS\product\0\8\honda-08213-10w30-engine-oil-12oz-10w30.jpg,Honda,,,Make sure your engine stays healthy and well-lubricated with Honda 12 oz. SAE 10W-30 Motor Oil. Honda Genuine quality SAE 10W-30 grade oil is formulated for use in 4-cycle engines. Formulated to meet the unique needs of power equipment.,,,ENGINE OIL 12OZ 10W30
28255,Engine Oil Drain Plugs,08E92-HPK2031,CABLE/RV ADAPTER KIT EU2,,E:\IMAGES\ITEMS\product\0\8\honda-08e92-hpk2031-cablerv-adapter-kit-eu2.jpg,Honda,,,"Parallel cord and the RV Adapter allow the user to obtain the full power of two EU2000 generators, limited only by the capacity of the 30-amp outlet. Linking a EU2000i and EU2000 Companion together will give you extra power when you need it, without having to trade up for a larger, heavier unit. You get more power without sacrificing portability.",,,CABLE/RV ADAPTER KIT EU2
28255,Engine Oil Drain Plugs,98056-54777,SPARK PLUG (CR4HSB),,E:\IMAGES\ITEMS\product\9\8\honda-98056-54777-spark-plug-cr4hsb.jpg,Honda,,,"The NGK Spark Plug is the workhorse, at the heart of smooth-running engines around the world OEM Quality Consistent Performance Plug of Choice in Millions of Marine Engines The spark plug insulators are made of 99 percent pure alumina silicate, allowing for longer insulator noses for reduced fouling",,,SPARK PLUG (CR4HSB)
20592,Inverters,EB2200ITA,2200 watt Generator Honda Inverter 120V AC power Ful,,E:\IMAGES\ITEMS\product\E\B\honda-eb2200ita-2200-watt-generator-honda-inverter-120v-ac-power-ful.jpg,Honda,,,"2200 watts, 18.3A, 120V                                                                   Super quiet - like a conversation                                                                   Fuel efficient - up to 8.1 hrs on 0.95 gal of gas                                                                   Lightweight - easy transport to and from the job                                                                   OSHA worksite compliant - meets job site emission and safety requirements                                                                   Inverter - stable power for sensitive equipment &amp; electronics",,,2200 watt Generator Honda Inverter 120V AC power Ful
23890,Generators,EB3000CK2A,3000 watt CycloConverter generator 12V DC Industrial,,E:\IMAGES\ITEMS\product\E\B\honda-eb3000ck2a-3000-watt-cycloconverter-generator-12v-dc-industrial.jpg,Honda,,,"This Honda EB3000C CYCLOCONVERTER™ Portable Generator features an easy-starting Honda OHV engine, GFCI protection and uses a special CPU to create stable, high quality power with less weight, compared to a traditional generator.",,,3000 watt CycloConverter generator 12V DC Industrial
23890,Generators,EB5000XK3,5000 watt GENERATOR w/Full GFCI protection iAVR power,,E:\IMAGES\ITEMS\product\E\B\honda-eb5000xk3-5000-watt-generator-wfull-gfci-protection-iavr-power.jpg,Honda,,,"5000 watts, 120/240V                                                                   Provides 7,000 watts for 10 secs to start larger equipment                                                                   Honda commercial iGX engine &amp; heavy duty frame                                                                   Full GFCI protection                                                                   OSHA worksite compliant - meets job site emission and safety requirements                                                                   Long run time - up to 11.2 hrs                                                                   120/240V selector switch",,,5000 watt GENERATOR w/Full GFCI protection iAVR power
23890,Generators,EB6500X1,6500 watt GENERATOR Full GFCI protection iAVR power Oil,,E:\IMAGES\ITEMS\product\E\B\honda-eb6500x1-6500-watt-generator-full-gfci-protection-iavr-power-oil.jpg,Honda,,,"6500 watts, 120/240V                                                                   Provides 7,000 watts for 10 secs to start larger equipment                                                                   Honda commercial iGX engine &amp; heavy duty frame                                                                   Full GFCI protection                                                                   OSHA worksite compliant - meets job site emission and safety requirements                                                                   Long run time - up to 10.4 hrs                                                                   120/240V selector switch                                                                   2 wheel kit &amp; lift hook",,,6500 watt GENERATOR Full GFCI protection iAVR power Oil
23890,Generators,EM6500SXK2,6500 watt GENERATOR Electric Start WITH BATTERY 12V D,,E:\IMAGES\ITEMS\product\E\M\honda-em6500sxk2-6500-watt-generator-electric-start-with-battery-12v-d.jpg,Honda,,,"6500 watts, 120/240V                                                                   Provides 7,000 watts for 10 sec to start larger equipment                                                                   Powers fridge, freezer, furnace, well pump, and much more                                                                   Long run time - up to 10.4 hrs                                                                   Powerful Honda iGX commercial engine                                                                   Electric start (battery included) with recoil back-up",,,6500 watt GENERATOR Electric Start WITH BATTERY 12V D
