category_ids,category_names,sku,meta_title,meta_description,Image,manufacturer,description,short_description,summary,upc,size_info,meta_keyword
23890,Generators,EU1000IK1A,1000 watt inverter GENERATOR 12V DC Ultra Quiet Lig,,E:\IMAGES\ITEMS\product\E\U\honda-eu1000ik1a-1000-watt-inverter-generator-12v-dc-ultra-quiet-lig.jpg,Honda,,,"1000 watts, 120V                                                                   Ideal for TV, lights, fans, small power tools and more                                                                   Super quiet                                                                   Less than 29 lbs!!                                                                   Fuel efficient - up to 7.1 hrs on 0.6 gal of gas                                                                   Inverter - stable power for computers and more",,,1000 watt inverter GENERATOR 12V DC Ultra Quiet Lig
23890,Generators,EU2200ITA,2200 watt inverter GENERATOR 12V DC Ultra Quiet Eco Th,,E:\IMAGES\ITEMS\product\E\U\honda-eu2200ita-2200-watt-inverter-generator-12v-dc-ultra-quiet-eco-th.jpg,Honda,,,"2200 watts, 120V                                                                   Ideal for TV, lights, fans, small power tools and more                                                                   Super quiet                                                                   Fuel efficient - up to 7.1 hrs on 0.6 gal of gas                                                                   Inverter - stable power for computers and more",,,2200 watt inverter GENERATOR 12V DC Ultra Quiet Eco Th
23890,Generators,EU2200ITA1,2200 watt inverter generator Ultra Quiet,,E:\IMAGES\ITEMS\product\E\U\honda-eu2200ita1-2200-watt-inverter-generator-ultra-quiet.jpg,Honda,,,"2200 watts, 120V                                                                   Ideal for TV, lights, fans, small power tools and more                                                                   Super quiet                                                                   Fuel efficient - up to 7.1 hrs on 0.6 gal of gas                                                                   Inverter - stable power for computers and more",,,2200 watt inverter generator Ultra Quiet
23890,Generators,WB20XT4A,General purpose pump OHV engine 2^ ports 152GL per m,,E:\IMAGES\ITEMS\product\W\B\honda-wb20xt4a-general-purpose-pump-ohv-engine-2-ports-152gl-per-m.jpg,Honda,,,"General purpose, centrifugal 2"" pump Easy starting Honda OHV commercial engine",,,General purpose pump OHV engine 2^ ports 152GL per m
23890,Generators,WT20XK4AC,Trash pump OHV engine 2^ ports 187GL per min. capac,,E:\IMAGES\ITEMS\product\W\T\honda-wt20xk4ac-trash-pump-ohv-engine-2-ports-187gl-per-min-capac.jpg,Honda,,,"Heavy-duty 2"" construction trash pump                                                                   Easy starting Honda OHV commercial engine                                                                   185 gal./min capacity                                                                   Solid handling capability up to 13/16""                                                                   Cast iron volute and impeller                                                                   Quick clean out port",,,Trash pump OHV engine 2^ ports 187GL per min. capac
23890,Generators,WT30XK4A,Trash pump OHV engine 3^ ports 319GPM capacity silico,,E:\IMAGES\ITEMS\product\W\T\honda-wt30xk4a-trash-pump-ohv-engine-3-ports-319gpm-capacity-silico.jpg,Honda,,,"Heavy-duty 3"" construction trash pump                                                                   Easy starting Honda OHV commercial engine                                                                   319 gal./min capacity                                                                   Solid handling capability up to 13/16""                                                                   Cast iron volute and impeller                                                                   Quick clean out port",,,Trash pump OHV engine 3^ ports 319GPM capacity silico
23890,Generators,WT40XK3A,Trash pump OHV engine 4^ ports 433GL per min. capaci,,E:\IMAGES\ITEMS\product\W\T\honda-wt40xk3a-trash-pump-ohv-engine-4-ports-433gl-per-min-capaci.jpg,Honda,,,"Heavy-duty 4"" construction trash pump                                                                   Easy starting Honda OHV commercial engine                                                                   433 gal./min capacity                                                                   Solid handling capability up to 13/16""                                                                   Cast iron volute and impeller                                                                   Quick clean out port",,,Trash pump OHV engine 4^ ports 433GL per min. capaci
23890,Generators,WX10K1AT,Water Pump. mini 4-stroke GX25 engine 1^ ports 37GL p,,E:\IMAGES\ITEMS\product\W\X\honda-wx10k1at-water-pump-mini-4-stroke-gx25-engine-1-ports-37gl-p.jpg,Honda,,,"Lightweight general purpose 1"" pump                                                                   Easy starting Honda mini 4-stroke engine                                                                   32 gal./min capacity                                                                   Weighs only 13 lbs.                                                                   Garden hose adaptor, suction hose, clamps, and strainer included",,,Water Pump. mini 4-stroke GX25 engine 1^ ports 37GL p
23901,Portable Generators,EB10000,10000 watt 120/240V Industrial Generator,,E:\IMAGES\ITEMS\product\E\B\honda-eb10000-10000-watt-120240v-industrial-generator.jpg,Honda,"The EB10000 uses Honda's exclusive DAVR (Digital Automatic Voltage Regulator). The DAVR is designed to hold the voltage stability within a +/- 1% range during operation. This provides more consistent power.  Powerful Honda GX630 commercial engine The Honda V-Twin engine offers more power, reliability, greater fuel economy and reduced emissions in a more compact package.",,"A centralized exhaust mechanism creates a unique ""hot"" zone for exhaust and ""cool"" zone for operation and passage.  The Honda EB10000 generator operates at a quiet noise level—73 decibels at 7 meters (equivalent to the noise of a vacuum cleaner).  Electric start 7 outlets for easy connection of multiple tools The control panel is positioned on the narrow side of the generator for convenient, easy access to all outlets. i-Monitor™ provides information on hours of operation, generator output voltage, and battery voltage, as well as diagnostics for convenient dealer servicing. You can rest easy, knowing your generator is covered from top to bottom for 3 full years. Hanger kit/lifting eye standard Easy folding handles Wide, positive lock folding handles offer convenient transport and storage and a more compact unit. The sturdy wheel kit makes the EB10000 easier to transport, even over rough terrain. The EB10000 runs an impressive 7.9 hours at half load and 5.4 hours at full load. The EB10000 offers neutral bond and full generator GFCI (Ground Fault Circuit Protection) on all outlets. low oil is detected.",,,10000 watt 120/240V Industrial Generator
23965,Electric Pressure Washers,GCV170,GCV170 pressure washer engine,,E:\IMAGES\ITEMS\product\G\C\honda-gcv170-gcv170-pressure-washer-engine.jpg,Honda,,"The all-new Honda GCV170 and GCV200 pressure washer engines deliver more: more power and more torque for premium residential applications, along with a range of technological attributes, innovative features and a simple design that make the new models eve",,,"Engine Type: Air-cooled 4-stroke single cylinder gasoline engine (OHV) Maximum Power Output* (hp /rpm): 4.8 / 3,600 Maximum Torque (lb ft /rpm): 8.2/ 2,500",GCV170 pressure washer engine
23965,Electric Pressure Washers,GCV200,GCV200 pressure washer engine,,E:\IMAGES\ITEMS\product\G\C\honda-gcv200-gcv200-pressure-washer-engine.jpg,Honda,,"The all-new Honda GCV170 and GCV200 pressure washer engines deliver more: more power and more torque for premium residential applications, along with a range of technological attributes, innovative features and a simple design that make the new models eve",,,"Engine Type: Air-cooled 4-stroke single cylinder gasoline engine (OHV) Maximum Power Output* (hp /rpm): 5.6 / 3,600 Maximum Torque (lb ft /rpm): 9.4 / 2,500",GCV200 pressure washer engine
