category_ids,category_names,sku,meta_title,meta_description,Image,manufacturer,description,short_description,summary,upc,size_info,meta_keyword
164|25635,Safety Glasses|Safety Glasses,3016310,Amber Lens Red Frame Safety Glasses,"Equalizer, Red Frame, Amber Lens",E:\IMAGES\ITEMS\product\3\0\Jackson-Safety-3016310-Equalizer-Amber-Lens-Red-Frame.jpg,Jackson Safety,"Equalizer, Red Frame, Amber Lens","Stylized frames feature a cutting edge design that's ideal for work and play Soft rubber nose pads for superior comfort and fit Sport grip temples eliminates slippage Dual lenses with an 8-base curve that provides wrap-around protection Lens options include anti-scratch or anti-fog coating Complete with micro-fiber carry pouch that doubles as a cleaning cloth High performance polycarbonate lens provides 99.9% UV protection Exceeds the ""High Impact"" level of the ANSI Z87.1+ safety standards",,,Amber Lens Red Frame Safety Glasses,Amber Lens Red Frame Safety Glasses
164|25635,Safety Glasses|Safety Glasses,3016311,Blue Mirror Blue Frame Safety Glasses,"Equalizer, Blue Frame, Blue Mirror Lens",E:\IMAGES\ITEMS\product\3\0\Jackson-Safety-3016311-Equalizer-Blue-Mirror-Blue-Frame.jpg,Jackson Safety,"Equalizer, Blue Frame, Blue Mirror Lens","Stylized frames feature a cutting edge design that's ideal for work and play Soft rubber nose pads for superior comfort and fit Sport grip temples eliminates slippage Dual lenses with an 8-base curve that provides wrap-around protection Lens options include anti-scratch or anti-fog coating Complete with micro-fiber carry pouch that doubles as a cleaning cloth High performance polycarbonate lens provides 99.9% UV protection Exceeds the ""High Impact"" level of the ANSI Z87.1+ safety standards",,,Blue Mirror Blue Frame Safety Glasses,Blue Mirror Blue Frame Safety Glasses
164|25635,Safety Glasses|Safety Glasses,3016312,Clear Anti Fog Safety Glasses,"Elite, Black Frame, Clear Anti-Fog Lens",E:\IMAGES\ITEMS\product\3\0\Jackson-Safety-3016312-Elite-Clear-Anti-Fog-Safety-Glasses.jpg,Jackson Safety,"Elite, Black Frame, Clear Anti-Fog Lens","Lightweight ""retro-style"" design provides the latest fashion statement Wide temple design provides structural integrity and stability Cut to shape lenses prevent image distortion Dual lenses with an 8-base curve that provides wrap-around protection Lens options include anti-scratch or anti-fog coating Complete with micro-fiber carry pouch that doubles as a cleaning cloth High performance polycarbonate lens provides 99.9% UV protection Exceeds the ""High Impact"" level of the ANSI Z87.1+ safety standards",,,Clear Anti Fog Safety Glasses,Clear Anti Fog Safety Glasses
164|25635,Safety Glasses|Safety Glasses,3016313,Smoke Anti Fog Safety Glasses,"Elite, Black Frame, Smoke Anti-Fog Lens",E:\IMAGES\ITEMS\product\3\0\Jackson-Safety-3016313-Elite-Smoke-Anti-Fog-Safety-Glasses.jpg,Jackson Safety,"Elite, Black Frame, Smoke Anti-Fog Lens","Lightweight ""retro-style"" design provides the latest fashion statement Wide temple design provides structural integrity and stability Cut to shape lenses prevent image distortion Dual lenses with an 8-base curve that provides wrap-around protection Lens options include anti-scratch or anti-fog coating Complete with micro-fiber carry pouch that doubles as a cleaning cloth High performance polycarbonate lens provides 99.9% UV protection Exceeds the ""High Impact"" level of the ANSI Z87.1+ safety standards",,,Smoke Anti Fog Safety Glasses,Smoke Anti Fog Safety Glasses
164|25635,Safety Glasses|Safety Glasses,3016314,Amber Anti Fog Safety Glasses,"Elite, Black Frame, Amber Anti-Fog Lens",E:\IMAGES\ITEMS\product\3\0\Jackson-Safety-3016314-Elite-Amber-Anti-Fog-Safety-Glasses.jpg,Jackson Safety,"Elite, Black Frame, Amber Anti-Fog Lens","Lightweight ""retro-style"" design provides the latest fashion statement Wide temple design provides structural integrity and stability Cut to shape lenses prevent image distortion Dual lenses with an 8-base curve that provides wrap-around protection Lens options include anti-scratch or anti-fog coating Complete with micro-fiber carry pouch that doubles as a cleaning cloth High performance polycarbonate lens provides 99.9% UV protection Exceeds the ""High Impact"" level of the ANSI Z87.1+ safety standards",,,Amber Anti Fog Safety Glasses,Amber Anti Fog Safety Glasses
164|25635,Safety Glasses|Safety Glasses,3016315,In/Outdoor Anti Fog Safety Glasses,"Elite, Black Frame, Indoor/Outdoor Lens",E:\IMAGES\ITEMS\product\3\0\Jackson-Safety-3016315-Elite-IndOut-Anti-Fog-Safety-Glasses.jpg,Jackson Safety,"Elite, Black Frame, Indoor/Outdoor Lens","Lightweight ""retro-style"" design provides the latest fashion statement Wide temple design provides structural integrity and stability Cut to shape lenses prevent image distortion Dual lenses with an 8-base curve that provides wrap-around protection Lens options include anti-scratch or anti-fog coating Complete with micro-fiber carry pouch that doubles as a cleaning cloth High performance polycarbonate lens provides 99.9% UV protection Exceeds the ""High Impact"" level of the ANSI Z87.1+ safety standards",,,In/Outdoor Anti Fog Safety Glasses,In/Outdoor Anti Fog Safety Glasses
164|25635,Safety Glasses|Safety Glasses,3016316,Blue Mirror Safety Glasses,"Elite, Black Frame, Blue Mirror Lens",E:\IMAGES\ITEMS\product\3\0\Jackson-Safety-3016316-Elite-Blue-Mirror-Safety-Glasses-S.jpg,Jackson Safety,"Elite, Black Frame, Blue Mirror Lens","Lightweight ""retro-style"" design provides the latest fashion statement Wide temple design provides structural integrity and stability Cut to shape lenses prevent image distortion Dual lenses with an 8-base curve that provides wrap-around protection Lens options include anti-scratch or anti-fog coating Complete with micro-fiber carry pouch that doubles as a cleaning cloth High performance polycarbonate lens provides 99.9% UV protection Exceeds the ""High Impact"" level of the ANSI Z87.1+ safety standards",,,Blue Mirror Safety Glasses,Blue Mirror Safety Glasses
26141,High Visibility & Cooling Vests,3017591,Lime Mesh Safety Vest,Econo Style ESK Safety Vests (Lime),E:\IMAGES\ITEMS\product\3\0\Jackson-Safety-3017591-Lime-Mesh-Safety-HL-Vest-White.jpg,Jackson Safety,Econo Style ESK Safety Vests (Lime),One Size Fits Most Elastic Sides for easy fit Mesh Fabric Hook and Look Closure,,,Lime Mesh Safety Vest,Lime Mesh Safety Vest
26141,High Visibility & Cooling Vests,3017594,Orange Mesh Safety Vest,"Econo Style ESK Safety Vests, Orange",E:\IMAGES\ITEMS\product\3\0\Jackson-Safety-3017594-Orange-Mesh-Safety-HL-Vest-White.jpg,Jackson Safety,"Econo Style ESK Safety Vests, Orange",One Size Fits Most Elastic Sides for easy fit Mesh Fabric Hook and Look Closure,,,Orange Mesh Safety Vest,Orange Mesh Safety Vest
26141,High Visibility & Cooling Vests,3022275,M/L Class 2 Orange Vest Solid,"ANSI Class 2 Deluxe Styles, Orange",E:\IMAGES\ITEMS\product\3\0\Jackson-Safety-3022275-ML-Class-2-Orange-Vest-Solid-Zipper.jpg,Jackson Safety,"ANSI Class 2 Deluxe Styles, Orange",4 pocket design (2 exterior and 2 interior) for increased carrying space Rugged color matched front zipper closure 360 degree visibility with high intensity tape Machine washable Durable material with mesh or solid fabric option Silver bead or color prismatic reflective tape,,,M/L Class 2 Orange Vest Solid,M/L Class 2 Orange Vest Solid
26141,High Visibility & Cooling Vests,3022276,XL/2X Class 2 Orange Vest Solid,"ANSI Class 2 Deluxe Styles, Orange",E:\IMAGES\ITEMS\product\3\0\Jackson-Safety-3022276-XL2X-Class-2-Orange-Vest-Solid.jpg,Jackson Safety,"ANSI Class 2 Deluxe Styles, Orange",4 pocket design (2 exterior and 2 interior) for increased carrying space Rugged color matched front zipper closure 360 degree visibility with high intensity tape Machine washable Durable material with mesh or solid fabric option Silver bead or color prismatic reflective tape,,,XL/2X Class 2 Orange Vest Solid,XL/2X Class 2 Orange Vest Solid
26141,High Visibility & Cooling Vests,3022277,3X/4X Class 2 Orange Vest Solid,"ANSI Class 2 Deluxe Styles, Orange 3X/4X",E:\IMAGES\ITEMS\product\3\0\Jackson-Safety-3022277-3X4X-Class-2-Orange-Vest-Solid.jpg,Jackson Safety,"ANSI Class 2 Deluxe Styles, Orange 3X/4X",4 pocket design (2 exterior and 2 interior) for increased carrying space Rugged color matched front zipper closure 360 degree visibility with high intensity tape Machine washable Durable material with mesh or solid fabric option Silver bead or color prismatic reflective tape Meets ANSI / ISEA 107 - 2004 Class 2 standards,,,3X/4X Class 2 Orange Vest Solid,3X/4X Class 2 Orange Vest Solid
26141,High Visibility & Cooling Vests,3022278,M/L Class 2 Lime Vest Solid,"ANSI Class 2 Deluxe Styles, Lime M/L",E:\IMAGES\ITEMS\product\3\0\Jackson-Safety-3022278-ML-Class-2-Lime-Vest-Solid-Zipper-4.jpg,Jackson Safety,"ANSI Class 2 Deluxe Styles, Lime M/L",4 pocket design (2 exterior and 2 interior) for increased carrying space Rugged color matched front zipper closure 360 degree visibility with high intensity tape Machine washable Durable material with mesh or solid fabric option Silver bead or color prismatic reflective tape Meets ANSI / ISEA 107 - 2004 Class 2 standards,,,M/L Class 2 Lime Vest Solid,M/L Class 2 Lime Vest Solid
26141,High Visibility & Cooling Vests,3022279,XL/2X Class 2 Lime Vest Solid,"ANSI Class 2 Deluxe Styles, Lime XL/2X",E:\IMAGES\ITEMS\product\3\0\Jackson-Safety-3022279-XL2X-Class-2-Lime-Vest-Solid-Zipper.jpg,Jackson Safety,"ANSI Class 2 Deluxe Styles, Lime XL/2X",4 pocket design (2 exterior and 2 interior) for increased carrying space Rugged color matched front zipper closure 360 degree visibility with high intensity tape Machine washable Durable material with mesh or solid fabric option Silver bead or color prismatic reflective tape Meets ANSI / ISEA 107 - 2004 Class 2 standards,,,XL/2X Class 2 Lime Vest Solid,XL/2X Class 2 Lime Vest Solid
26141,High Visibility & Cooling Vests,3022280,3X/4X Class 2 Lime Vest Solid,"ANSI Class 2 Deluxe Styles, Lime 3X/4X",E:\IMAGES\ITEMS\product\3\0\Jackson-Safety-3022280-3X4X-Class-2-Lime-Vest-Solid-Zipper.jpg,Jackson Safety,"ANSI Class 2 Deluxe Styles, Lime 3X/4X",4 pocket design (2 exterior and 2 interior) for increased carrying space Rugged color matched front zipper closure 360 degree visibility with high intensity tape Machine washable Durable material with mesh or solid fabric option Silver bead or color prismatic reflective tape Meets ANSI / ISEA 107 - 2004 Class 2 standards,,,3X/4X Class 2 Lime Vest Solid,3X/4X Class 2 Lime Vest Solid
26141,High Visibility & Cooling Vests,3022281,M/L Class 2 Orange Vest Mesh,"ANSI Class 2 Deluxe Styles, Orange M/L",E:\IMAGES\ITEMS\product\3\0\Jackson-Safety-3022281-ML-Class-2-Orange-Vest-Mesh-Zipper-4.jpg,Jackson Safety,"ANSI Class 2 Deluxe Styles, Orange M/L",4 pocket design (2 exterior and 2 interior) for increased carrying space Rugged color matched front zipper closure 360 degree visibility with high intensity tape Machine washable Durable material with mesh or solid fabric option Silver bead or color prismatic reflective tape Meets ANSI / ISEA 107 - 2004 Class 2 standards,,,M/L Class 2 Orange Vest Mesh,M/L Class 2 Orange Vest Mesh
26141,High Visibility & Cooling Vests,3022282,XL/2X Class 2 Orange Vest Mesh,"ANSI Class 2 Deluxe Styles, Orange XL/2X",E:\IMAGES\ITEMS\product\3\0\Jackson-Safety-3022282-XL2X-Class-2-Orange-Vest-Mesh-Zipper.jpg,Jackson Safety,"ANSI Class 2 Deluxe Styles, Orange XL/2X",4 pocket design (2 exterior and 2 interior) for increased carrying space Rugged color matched front zipper closure 360 degree visibility with high intensity tape Machine washable Durable material with mesh or solid fabric option Silver bead or color prismatic reflective tape Meets ANSI / ISEA 107 - 2004 Class 2 standards,,,XL/2X Class 2 Orange Vest Mesh,XL/2X Class 2 Orange Vest Mesh
26141,High Visibility & Cooling Vests,3022283,3X/4X Class 2 Orange Vest Mesh,"ANSI Class 2 Deluxe Styles, Orange 3X/4X",E:\IMAGES\ITEMS\product\3\0\Jackson-Safety-3022283-3X4X-Class-2-Orange-Vest-Mesh-Zipper.jpg,Jackson Safety,"ANSI Class 2 Deluxe Styles, Orange 3X/4X",4 pocket design (2 exterior and 2 interior) for increased carrying space Rugged color matched front zipper closure 360 degree visibility with high intensity tape Machine washable Durable material with mesh or solid fabric option Silver bead or color prismatic reflective tape Meets ANSI / ISEA 107 - 2004 Class 2 standards,,,3X/4X Class 2 Orange Vest Mesh,3X/4X Class 2 Orange Vest Mesh
26141,High Visibility & Cooling Vests,3022284,M/L Lime Class 2 Vest Mesh Silver Tape,"ANSI Class 2 Deluxe Styles, Orange, Silver Tape M/L",E:\IMAGES\ITEMS\product\3\0\Jackson-Safety-3022284-ML-Lime-Class-2-Vest-Mesh-Zipper.jpg,Jackson Safety,"ANSI Class 2 Deluxe Styles, Orange, Silver Tape M/L",4 pocket design (2 exterior and 2 interior) for increased carrying space Rugged color matched front zipper closure 360 degree visibility with high intensity tape Machine washable Durable material with mesh or solid fabric option Silver bead or color prismatic reflective tape Meets ANSI / ISEA 107 - 2004 Class 2 standards,,,M/L Lime Class 2 Vest Mesh Silver Tape,M/L Lime Class 2 Vest Mesh Silver Tape
26141,High Visibility & Cooling Vests,3022285,XL/2X Lime Class 2 Vest Mesh Silver Tape,"ANSI Class 2 Deluxe Styles, Lime XL/2X",E:\IMAGES\ITEMS\product\3\0\Jackson-Safety-3022285-XL2X-Lime-Class-2-Vest-Mesh-Zipper.jpg,Jackson Safety,"ANSI Class 2 Deluxe Styles, Lime XL/2X",4 pocket design (2 exterior and 2 interior) for increased carrying space Rugged color matched front zipper closure 360 degree visibility with high intensity tape Machine washable Durable material with mesh or solid fabric option Silver bead or color prismatic reflective tape Meets ANSI / ISEA 107 - 2004 Class 2 standards,,,XL/2X Lime Class 2 Vest Mesh Silver Tape,XL/2X Lime Class 2 Vest Mesh Silver Tape
26141,High Visibility & Cooling Vests,3022286,3X/4X Lime Class 2 Vest Silver Tape,"ANSI Class 2 Deluxe Style, Lime 3X/4X",E:\IMAGES\ITEMS\product\3\0\Jackson-Safety-3022286-3X4X-Lime-Class-2-Vest-Mesh-Zipper.jpg,Jackson Safety,"ANSI Class 2 Deluxe Style, Lime 3X/4X",4 pocket design (2 exterior and 2 interior) for increased carrying space Rugged color matched front zipper closure 360 degree visibility with high intensity tape Machine washable Durable material with mesh or solid fabric option Silver bead or color prismatic reflective tape Meets ANSI / ISEA 107 - 2004 Class 2 standards,,,3X/4X Lime Class 2 Vest Silver Tape,3X/4X Lime Class 2 Vest Silver Tape
26141,High Visibility & Cooling Vests,3022293,M/L Orange Class 2 Vest,"ANSI Class 2 Standard Styles, Orange M/L",E:\IMAGES\ITEMS\product\3\0\Jackson-Safety-3022293-ML-Orange-Class-2-Vest-Mesh-HL.jpg,Jackson Safety,"ANSI Class 2 Standard Styles, Orange M/L",Hook and Loop front closure 360 degree visibility with high intensity tape Machine washable Silver bead reflective tape on mesh or solid fabric options Meets ANSI / ISEA 107 - 2004 Class 2 standards,,,M/L Orange Class 2 Vest,M/L Orange Class 2 Vest
26141,High Visibility & Cooling Vests,3022294,XL/2X Orange Class 2 Vest,"ANSI Class 2 Standard Styles, Orange XL/2X",E:\IMAGES\ITEMS\product\3\0\Jackson-Safety-3022294-XL2X-Orange-Class-2-Vest-Mesh-HL.jpg,Jackson Safety,"ANSI Class 2 Standard Styles, Orange XL/2X",Hook and Loop front closure 360 degree visibility with high intensity tape Machine washable Silver bead reflective tape on mesh or solid fabric options Meets ANSI / ISEA 107 - 2004 Class 2 standards,,,XL/2X Orange Class 2 Vest,XL/2X Orange Class 2 Vest
26141,High Visibility & Cooling Vests,3022295,3X-4X Orange Class 2 Vest,"ANSI Class 2 Standard Styles, Orange 3X-4X",E:\IMAGES\ITEMS\product\3\0\Jackson-Safety-3022295-3X-4X-Orange-Class-2-Vest-Mesh-HL.jpg,Jackson Safety,"ANSI Class 2 Standard Styles, Orange 3X-4X",Hook and Loop front closure 360 degree visibility with high intensity tape Machine washable Silver bead reflective tape on mesh or solid fabric options Meets ANSI / ISEA 107 - 2004 Class 2 standards,,,3X-4X Orange Class 2 Vest,3X-4X Orange Class 2 Vest
26141,High Visibility & Cooling Vests,3022296,M/L Lime Class 2 Vest,"ANSI Class 2 Standard Styles, Lime M/L",E:\IMAGES\ITEMS\product\3\0\Jackson-Safety-3022296-ML-Lime-Class-2-Vest-Mesh-HL-Silver.jpg,Jackson Safety,"ANSI Class 2 Standard Styles, Lime M/L",Hook and Loop front closure 360 degree visibility with high intensity tape Machine washable Silver bead reflective tape on mesh or solid fabric options Meets ANSI / ISEA 107 - 2004 Class 2 standards,,,M/L Lime Class 2 Vest,M/L Lime Class 2 Vest
26141,High Visibility & Cooling Vests,3022297,XL/2X Lime Class 2 Vest,"ANSI Class 2 Standard Styles, Lime XL/2X",E:\IMAGES\ITEMS\product\3\0\Jackson-Safety-3022297-XL2X-Lime-Class-2-Vest-Mesh-HL.jpg,Jackson Safety,"ANSI Class 2 Standard Styles, Lime XL/2X",Hook and Loop front closure 360 degree visibility with high intensity tape Machine washable Silver bead reflective tape on mesh or solid fabric options Meets ANSI / ISEA 107 - 2004 Class 2 standards,,,XL/2X Lime Class 2 Vest,XL/2X Lime Class 2 Vest
26141,High Visibility & Cooling Vests,3022298,3X-4X Lime Class 2 Vest,"ANSI Class 2 Standard Styles, Lime 3X-4X",E:\IMAGES\ITEMS\product\3\0\Jackson-Safety-3022298-3X-4X-Lime-Class-2-Vest-Mesh-HL.jpg,Jackson Safety,"ANSI Class 2 Standard Styles, Lime 3X-4X",Hook and Loop front closure 360 degree visibility with high intensity tape Machine washable Silver bead reflective tape on mesh or solid fabric options Meets ANSI / ISEA 107 - 2004 Class 2 standards,,,3X-4X Lime Class 2 Vest,3X-4X Lime Class 2 Vest
26141,High Visibility & Cooling Vests,3022323,M/L Lime Class 2 Vest Mesh H&L 5-Pt Break Away,"ANSI Class 2 5Pt. Break-Away Standard Vest, Lime-Silver Tape",E:\IMAGES\ITEMS\product\3\0\Jackson-Safety-3022323-ML-Lime-Class-2-Vest-Mesh-HL-5-Pt.jpg,Jackson Safety,"ANSI Class 2 5Pt. Break-Away Standard Vest, Lime-Silver Tape","5 pt. break-away safety vest system prevents fabric from getting caught on vehicles, machinery and more Breaks apart at both shoulders, both sides and front Silver bead reflective tape on mesh fabric 100% polyester Machine washable","ANSI Class 2 5Pt. Break-Away Standard Vest, Lime-Silver Tape",,M/L Lime Class 2 Vest Mesh H&L 5-Pt Break Away,M/L Lime Class 2 Vest Mesh H&L 5-Pt Break Away
26141,High Visibility & Cooling Vests,3022324,XL-2X Lime Class 2 Vest Mesh H&L 5Pt. Break Away,"ANSI Class 2 5 Pt. Break-Away Standard Vest, Lime XL-2X",E:\IMAGES\ITEMS\product\3\0\Jackson-Safety-3022324-XL-2X-Lime-Class-2-Vest-Mesh-HL-5Pt.jpg,Jackson Safety,"ANSI Class 2 5 Pt. Break-Away Standard Vest, Lime XL-2X","5 pt. break-away safety vest system prevents fabric from getting caught on vehicles, machinery and more Breaks apart at both shoulders, both sides and front Silver bead reflective tape on mesh fabric 100% polyester Machine washable","ANSI Class 2 5 Pt. Break-Away Standard Vest, Lime",,XL-2X Lime Class 2 Vest Mesh H&L 5Pt. Break Away,XL-2X Lime Class 2 Vest Mesh H&L 5Pt. Break Away
26141,High Visibility & Cooling Vests,3022325,3X-4X Lime Class 2 Vest Mesh H&L-5pt Break Away,"ANSI Class 2 5Pt. Break-Away Standard Vest, Lime 3X-4X",E:\IMAGES\ITEMS\product\3\0\Jackson-Safety-3022325-3X-4X-Lime-Class-2-Vest-Mesh-HL-5pt.jpg,Jackson Safety,"ANSI Class 2 5Pt. Break-Away Standard Vest, Lime 3X-4X","5 pt. break-away safety vest system prevents fabric from getting caught on vehicles, machinery and more Breaks apart at both shoulders, both sides and front Silver bead reflective tape on mesh fabric 100% polyester Machine washable","ANSI Class 2 5Pt. Break-Away Standard Vest, Lime",,3X-4X Lime Class 2 Vest Mesh H&L-5pt Break Away,3X-4X Lime Class 2 Vest Mesh H&L-5pt Break Away
26141,High Visibility & Cooling Vests,3022349,M/L Orange Class 3 Vest Mesh H&L-Silver Tape,"ANSI Class 3 Standard Styles, Orange M/L",E:\IMAGES\ITEMS\product\3\0\Jackson-Safety-3022349-ML-Orange-Class-3-Vest-Mesh-HL.jpg,Jackson Safety,"ANSI Class 3 Standard Styles, Orange M/L",Hook and Loop Front Closure 360 degree visibility Machine Washable Silver beaded reflective tape on mesh fabric Meets ANSI / ISEA 107 - 2004 Class 3 standards,,,M/L Orange Class 3 Vest Mesh H&L-Silver Tape,M/L Orange Class 3 Vest Mesh H&L-Silver Tape
26141,High Visibility & Cooling Vests,3022350,XL/2X Orange Class 3 Vest Mesh-Silver Tape,"ANSI Class 3 Standard Styles, Orange XL/2X",E:\IMAGES\ITEMS\product\3\0\Jackson-Safety-3022350-XL2X-Orange-Class-3-Vest-Mesh-Silver.jpg,Jackson Safety,"ANSI Class 3 Standard Styles, Orange XL/2X",Hook and Loop Front Closure 360 degree visibility Machine Washable Silver beaded reflective tape on mesh fabric Meets ANSI / ISEA 107 - 2004 Class 3 standards,,,XL/2X Orange Class 3 Vest Mesh-Silver Tape,XL/2X Orange Class 3 Vest Mesh-Silver Tape
26141,High Visibility & Cooling Vests,3022351,3X-4X Orange Class 3 Vest Mesh H&L-Silver Tape,"ANSI Class 3 Standard Styles, Orange 3X-4X",E:\IMAGES\ITEMS\product\3\0\Jackson-Safety-3022351-3X-4X-Orange-Class-3-Vest-Mesh-HL.jpg,Jackson Safety,"ANSI Class 3 Standard Styles, Orange 3X-4X",Hook and Loop Front Closure 360 degree visibility Machine Washable Silver beaded reflective tape on mesh fabric Meets ANSI / ISEA 107 - 2004 Class 3 standards,,,3X-4X Orange Class 3 Vest Mesh H&L-Silver Tape,3X-4X Orange Class 3 Vest Mesh H&L-Silver Tape
26141,High Visibility & Cooling Vests,3022352,M/L Lime Class 3 Vest Mesh H&L-Silver Tape,"ANSI Class 3 Standard Styles, Lime M/L",E:\IMAGES\ITEMS\product\3\0\Jackson-Safety-3022352-ML-Lime-Class-3-Vest-Mesh-HL-Silver.jpg,Jackson Safety,"ANSI Class 3 Standard Styles, Lime M/L",Hook and Loop Front Closure 360 degree visibility Machine Washable Silver beaded reflective tape on mesh fabric Meets ANSI / ISEA 107 - 2004 Class 3 standards,,,M/L Lime Class 3 Vest Mesh H&L-Silver Tape,M/L Lime Class 3 Vest Mesh H&L-Silver Tape
26141,High Visibility & Cooling Vests,3022353,XL/2X Lime Class 3 Vest Mesh H&L-Silver Tape,"ANSI Class 3 Standard Style, Lime XL/2X",E:\IMAGES\ITEMS\product\3\0\Jackson-Safety-3022353-XL2X-Lime-Class-3-Vest-Mesh-HL.jpg,Jackson Safety,"ANSI Class 3 Standard Style, Lime XL/2X",Hook and Loop Front Closure 360 degree visibility Machine Washable Silver beaded reflective tape on mesh fabric Meets ANSI / ISEA 107 - 2004 Class 3 standards,,,XL/2X Lime Class 3 Vest Mesh H&L-Silver Tape,XL/2X Lime Class 3 Vest Mesh H&L-Silver Tape
26141,High Visibility & Cooling Vests,3022354,3X-4X Lime Class 3 Vest Mesh H&L-Silver Tape,"ANSI Class 3 Standard Styles, Lime 3X-4X",E:\IMAGES\ITEMS\product\3\0\Jackson-Safety-3022354-3X-4X-Lime-Class-3-Vest-Mesh-HL.jpg,Jackson Safety,"ANSI Class 3 Standard Styles, Lime 3X-4X",Hook and Loop Front Closure 360 degree visibility Machine Washable Silver beaded reflective tape on mesh fabric Meets ANSI / ISEA 107 - 2004 Class 3 standards,,,3X-4X Lime Class 3 Vest Mesh H&L-Silver Tape,3X-4X Lime Class 3 Vest Mesh H&L-Silver Tape
360|26097,Sand Barrels|Traffic Barrels and Drums,3022798,Traffic Barrell/Drum Does Not Include Base,TrailBOSS Channelizer Drum,E:\IMAGES\ITEMS\product\3\0\Jackson-Safety-3022798-Traffic-BarrellDrum-Does-Not-Include.jpg,Jackson Safety,TrailBOSS Channelizer Drum,"Meets MUTCD and NCHRP-350 requirements with or without barricade lights Drum designed to inhibit roll after impact to eliminate further hazards or potential damage Tapered drum design enables nesting for storage or transport Drum handle accommodates one or two Type A or C lights designed to be attached with a standard size bolt and bolt protector Drum Height: 41.27"", Drum Diameter (at bottom): 23 Choice of 4 different bases: HDPE Drum Snap-On Base, 25 lb. Drum Base, 40 lb. Drum Base and 22.5"" Tire Ring 1600 models are constructed of linear low density polyethylene, 1610 models are constructed of high density polyethylene Old TrailBOSS drums and bases are NOT interchangeable with updated TrailBOSS products manufactured after Decembe 2008 Plastic Snap-On Base can be weighted down with a sandbag",,,Jackson Safety 3022798 Traffic Barrell/Drum Does Not Include Base,Traffic Barrell/Drum Does Not Include Base
360|26097,Sand Barrels|Traffic Barrels and Drums,3022807,25LB Rubber Base,25Lb Rubber Drum Base,E:\IMAGES\ITEMS\product\3\0\Jackson-Safety-3022807-25LB-Rubber.jpg,Jackson Safety,25Lb Rubber Drum Base,"Choice of 4 different bases: HDPE Drum Snap-On Base, 25 lb. Drum Base, 40 lb. Drum Base and 22.5"" Tire Ring 1600 models are constructed of linear low density polyethylene, 1610 models are constructed of high density polyethylene Old TrailBOSS drums and bases are NOT interchangeable with updated TrailBOSS products manufactured after Decembe 2008 Plastic Snap-On Base can be weighted down with a sandbag",,,Jackson Safety 3022807 25LB Rubber Base,25LB Rubber Base
25964,Nuisance Dust and Procedural Masks,12978,Dust Mask 1-Strap 50 Per Box,Disposable Respirator,E:\IMAGES\ITEMS\product\1\2\Jackson-Safety-12978-Dust-Mask-1-Strap-50-Per.jpg,Jackson Safety,Disposable Respirator,Adjustable metal nosepiece Lightweight fiber for comfort Not NIOSH Approved,,,Jackson Safety 12978 Dust Mask 1-Strap 50 Per Box,Dust Mask 1-Strap 50 Per Box
159|25842,Hard Hats|Hard Hats,15425,Black CYCO Hat w/ Ratchet 8Pt. Nylon Suspension,Blockhead,E:\IMAGES\ITEMS\product\1\5\Jackson-Safety-15425-Black-CYCO-Hat-w-Ratchet-8Pt-Nylon.jpg,Jackson Safety,Blockhead,"Meets ANSI Z89.1 Type 1, Class C, G, and E Full 360 degree brim adds protection from natures elements Lightweight from comfort, molded from High Density Polyethylene (HDPE) - only weighs 16.3 oz.! Smooth dome leaving no crevices for build-up Reinforced brim ensuring longevity and safety Soft absorbent cloth absorbs sweat keeping you safe and comfortable 8 pt. ratchet suspension Attaches to 37 Hatshield",,,Jackson Safety 15425 Black CYCO Hat w/ Ratchet 8Pt. Nylon Suspension,Black CYCO Hat w/ Ratchet 8Pt. Nylon Suspension
