category_ids,category_names,sku,meta_title,meta_description,Image,manufacturer,description,short_description,summary,upc,size_info,meta_keyword
159|25838,Hard Hats|Hard Hat Face Shields,3000001,A-F3000L Headgear,Model K Headger,E:\IMAGES\ITEMS\product\3\0\Jackson-Safety-3000001-A-F3000L.jpg,Jackson Safety,Model K Headger,"Spark deflector Soft, absorbent wrap-around foam cushioned sweatband gently hugs the natural shape of the head Ratchet and Pinlock supension options Meets ANSI Z87.1 Standard Faceshield sold separately",,,Jackson Safety 3000001 A-F3000L Headgear,A-F3000L Headgear
159|25838,Hard Hats|Hard Hat Face Shields,3000032,Aluminum Bracket For Cap,Model C Bracket (Cap Coil Spring Attachment),E:\IMAGES\ITEMS\product\3\0\Jackson-Safety-3000032-Aluminum-Bracket-For.jpg,Jackson Safety,Model C Bracket (Cap Coil Spring Attachment),"Fits most safety caps Simple ""on-off"" attachment/replacement system Holds a variety of Huntsman visors Visor sold separately Meets CSA Standards Standard package 12",,,Jackson Safety 3000032 Aluminum Bracket For Cap,Aluminum Bracket For Cap
164|25635,Safety Glasses|Safety Glasses,3000354,Nemesis Black Frame Clear Lens,Nemesis Black Frame Clear Lens Safety Glasses V30,E:\IMAGES\ITEMS\product\3\0\Jackson-Safety-3000354-Nemesis-Black-Frame-Clear.jpg,Jackson Safety,Nemesis Black Frame Clear Lens Safety Glasses V30,"NOW AVAILABLE in new Camo Frame/Lens combos and a hot new Red Frame/Smoke Lens Sleek, sporty style Soft touch temples Lightweight construction Single lens wrap-around protection Includes free neck cord Also available in CSA models Standard package 12 Base Curve 8 Select non-polarized Nemesis eyewear available in gravity feed retail display box",,,Nemesis Black Frame Clear Lens,Nemesis Black Frame Clear Lens
164|25635,Safety Glasses|Safety Glasses,3000356,Nemesis Black Frame Smoke Mirror Lens,Nemesis Black Frame w/ Smoke Mirror Lens Safety Glasses,E:\IMAGES\ITEMS\product\3\0\Jackson-Safety-3000356-Nemesis-Black-Frame-Smoke-Mirror.jpg,Jackson Safety,Nemesis Black Frame w/ Smoke Mirror Lens Safety Glasses,"Sleek, sporty style Soft touch temples Lightweight construction Single lens wrap-around protection Includes free neck cord Also available in CSA models Standard package 12 Base Curve 8 Select non-polarized Nemesis eyewear available in gravity feed retail display box",,,Nemesis Black Frame Smoke Mirror Lens,Nemesis Black Frame Smoke Mirror Lens
164|25635,Safety Glasses|Safety Glasses,3000358,Nemesis Black Frame Blue Mirror Lens,Nemesis Black Frame w/ Blue Mirror Lens Safety Glasses,E:\IMAGES\ITEMS\product\3\0\Jackson-Safety-3000358-Nemesis-Black-Frame-Blue-Mirror.jpg,Jackson Safety,Nemesis Black Frame w/ Blue Mirror Lens Safety Glasses,"Sleek, sporty style Soft touch temples Lightweight construction Single lens wrap-around protection Includes free neck cord Also available in CSA models Standard package 12 Base Curve 8 Select non-polarized Nemesis eyewear available in gravity feed retail display box",,,Nemesis Black Frame Blue Mirror Lens,Nemesis Black Frame Blue Mirror Lens
164|26144,Safety Glasses|Hats,3000435,AA-7M Orange Winterliners,Orange Wind Guard AA-7,E:\IMAGES\ITEMS\product\3\0\Jackson-Safety-3000435-AA-7M-Orange.jpg,Jackson Safety,Orange Wind Guard AA-7,Cap Style Standard Pack 12,,,Jackson Safety 3000435 AA-7M Orange Winterliners,AA-7M Orange Winterliners
159|25842,Hard Hats|Hard Hats,3000442,Quilted Winter Liner,Winter Liner 225 Plus,E:\IMAGES\ITEMS\product\3\0\Jackson-Safety-3000442-Quilted-Winter.jpg,Jackson Safety,Winter Liner 225 Plus,Blue quilted nylon shell with fastener straps Three layers of thick foam,,,Jackson Safety 3000442 Quilted Winter Liner,Quilted Winter Liner
164|25635,Safety Glasses|Safety Glasses,3000555,Lens Cleaning Toweletts,Lens Cleaning Station,E:\IMAGES\ITEMS\product\3\0\Jackson-Safety-3000555-Lens-Cleaning.jpg,Jackson Safety,Lens Cleaning Station,"Wall Monunt For Glass, plastic and polycarbonate lenses, goggles, and visors Anti-Fog, Anti-Static Formula Available in 100 individually package towelettes per box or spray bottle with 100 low tint tissues",,,Jackson Safety 3000555 Lens Cleaning Toweletts,Lens Cleaning Toweletts
164|25634,Safety Glasses|Replacement Eyewear Lenses,3000645,"2"" x 4-1/4"" Shade 10 Lens Replacement",Cover Lenses and Filter Plates,E:\IMAGES\ITEMS\product\3\0\Jackson-Safety-3000645-2-x-4-14-Shade-10-Lens.jpg,Jackson Safety,"427 Filter Lens Sh. 10 2"" x 4 1/4"" Polycarbonate Filter Lens","Cover Lenses, Filter Lenses, Safety Plates, and Magnifying Plates",,,"2"" x 4-1/4"" Shade 10 Lens Replacement","2"" x 4-1/4"" Shade 10 Lens Replacement"
164|25634,Safety Glasses|Replacement Eyewear Lenses,3000650,"4-1/2"" x 5-1/4"" Shade 10 Lens Replacement","1127 Filter Lens Sh. 10 4 1/2"" x 5 1/4"" Polycarbonate Filter Lens",E:\IMAGES\ITEMS\product\3\0\Jackson-Safety-3000650-4-12-x-5-14-Shade-10-Lens.jpg,Jackson Safety,"1127 Filter Lens Sh. 10 4 1/2"" x 5 1/4"" Polycarbonate Filter Lens","Cover Lenses, Filter Lenses, Safety Plates, and Magnifying Plates",,,"4-1/2"" x 5-1/4"" Shade 10 Lens Replacement","4-1/2"" x 5-1/4"" Shade 10 Lens Replacement"
26691,Welding Goggles,3002695,WELDING GOGGLES 2X4 SHADE 5 6061303,"V100 WS-80 Welding Goggles 2"" x 4-1/4"" Filter Plate",E:\IMAGES\ITEMS\product\3\0\Jackson-Safety-3002695-Welding-Goggles-2-x-4-14-Filter.jpg,Jackson Safety,"V100 WS-80 Welding Goggles 2"" x 4-1/4"" Filter Plate",Flexible frame Fixed front Shade 5.0 Meets ANSI Z87.1+ standards,,,"Jackson Safety 3002695 Welding Goggles 2"" x 4-1/4"" Filter Plate",WELDING GOGGLES 2X4 SHADE 5 6061303
164|25635,Safety Glasses|Safety Glasses,3004880,Element Clear Frame Clear Lens Safety Glasses,"Element Clear Frame, Clear Lens Safety Glasses",E:\IMAGES\ITEMS\product\3\0\Jackson-Safety-3004880-Element-Clear-Frame-Clear-Lens.jpg,Jackson Safety,"Element Clear Frame, Clear Lens Safety Glasses","Lightweight Design Sleek, popular styling with an economical price Universal nose bridge for comfort Base Curve 9.5",,,Jackson Safety 3004880 Element Clear Frame Clear Lens Safety Glasses,Element Clear Frame Clear Lens Safety Glasses
164|25635,Safety Glasses|Safety Glasses,3004882,Element Black Frame Smoke Lens Safety Glasses,"Element Black Frame, Smoke Lens",E:\IMAGES\ITEMS\product\3\0\Jackson-Safety-3004882-Element-Black-Frame-Smoke-Lens.jpg,Jackson Safety,"Element Black Frame, Smoke Lens","Lightweight Design Sleek, popular styling with an economical price Universal nose bridge for comfort Base Curve 9.5",,,Jackson Safety 3004882 Element Black Frame Smoke Lens Safety Glasses,Element Black Frame Smoke Lens Safety Glasses
159|25842,Hard Hats|Hard Hats,3005334,Sweatband,Drybrow Sweatbands,E:\IMAGES\ITEMS\product\3\0\Jackson-Safety-3005334.jpg,Jackson Safety,Drybrow Sweatbands,AA-100. Packaged 25/bag; individually sleeved for increased shelf life,,,Sweatband,Sweatband
159|25842,Hard Hats|Hard Hats,3005336,AA-102 Clip-On Sweatband,AA-102 Clip-On Sweatband,E:\IMAGES\ITEMS\product\3\0\Jackson-Safety-3005336-AA-102-Clip-On.jpg,Jackson Safety,AA-102 Clip-On Sweatband,AA-102. Deluxe clip-on. Packaged 25/bag,,,AA-102 Clip-On Sweatband,AA-102 Clip-On Sweatband
167|25838,Face Shields|Hard Hat Face Shields,3005382,"Medium Green Faceshield 8"" x 15.5"" x .040""","8""x15-1/2""x.040"" PETG 36pk F10 Face Shields",E:\IMAGES\ITEMS\product\3\0\Jackson-Safety-3005382-Medium-Green-Faceshield-8-x-155-x.jpg,Jackson Safety,"8""x15-1/2""x.040"" PETG 36pk F10 Face Shields","Low cost option Environmentally friendly Recommended applications: manufacturing, flying debris, general splash protection, chemical splash protection, dust protection, landscaping, food processing Meets ANSI Z87.1 - 2010 Standards",,,"Jackson Safety 3005382 Medium Green Faceshield 8"" x 15.5"" x .040""","Medium Green Faceshield 8"" x 15.5"" x .040"""
167|25838,Face Shields|Hard Hat Face Shields,3005399,"Clear Faceshield 8"" x 5-1/2"" x .040""","economical 8""x15-1/2""x.040"" PETG 100pk Clear Face Shield",E:\IMAGES\ITEMS\product\3\0\Jackson-Safety-3005399-Clear-Faceshield-8-x-5-12-x.jpg,Jackson Safety,"economical 8""x15-1/2""x.040"" PETG 100pk Clear Face Shield","Low cost option Environmentally friendly Recommended applications: manufacturing, flying debris, general splash protection, chemical splash protection, dust protection, landscaping, food processing",,,"Jackson Safety 3005399 Clear Faceshield 8"" x 5-1/2"" x .040""","Clear Faceshield 8"" x 5-1/2"" x .040"""
28372,Sign Stands and Hardware,3006183,"Fiberglass Sign Ribs for 48"" x 48"" Roll-Up Sign","FIBERGLASS RIBS FOR QUADRA FLEX V, SIGN STAND RIBS & HARDWARE FOR 48” ROLL-UP SIGNS",E:\IMAGES\ITEMS\product\3\0\Jackson-Safety-3006183-Fiberglass-Sign-Ribs-for-48-x-48.jpg,Jackson Safety,"FIBERGLASS RIBS FOR QUADRA FLEX V, SIGN STAND RIBS & HARDWARE FOR 48"" ROLL-UP SIGNS","All fiberglass ribs are coated with a ""polyester veil coating"" that reduces splinters and cracking Available for 36"" and 48"" roll-up signs",,,"Jackson Safety 3006183 Fiberglass Sign Ribs for 48"" x 48"" Roll-Up Sign","Fiberglass Sign Ribs for 48"" x 48"" Roll-Up Sign"
373|28071,Flags | Paddles|Stop and Go Signs,3006225,"18"" Stop/Slow Sign Aluminum","Sign Only, STOP/SLOW PDL, 18” NON-REFLECTIVE",E:\IMAGES\ITEMS\product\3\0\Jackson-Safety-3006225-18-StopSlow-Sign.jpg,Jackson Safety,"Sign Only, STOP/SLOW PDL, 18"" NON-REFLECTIVE","Aluminum silk-screened octagon shaped paddles in 15"" or 18"" size .080 gauge baked aluminum enamel. Available with 6"" aluminum, 6"" wooden or 6' wooden handles Ideal for school crossing guards, flaggers, and plant security guards Wood handle: 6.5"" Short / 6' Long, 7-1/8"" to bottom of sign Aluminum handle 5 3/16"", 14-7/8"" to bottom of sign",,,"18"" Stop/Slow Sign Aluminum","18"" Stop/Slow Sign Aluminum"
373|28071,Flags | Paddles|Stop and Go Signs,3006231,Short Wood Handle for Alumn. Stop/Slow,SHORT WOOD HANDLE FOR ALUM STOP & SLOW PADDLES,E:\IMAGES\ITEMS\product\3\0\Jackson-Safety-3006231-Short-Wood-Handle-for-Alumn.jpg,Jackson Safety,SHORT WOOD HANDLE FOR ALUM STOP & SLOW PADDLES,"Aluminum silk-screened octagon shaped paddles in 15"" or 18"" size .080 gauge baked aluminum enamel. Available with 6"" aluminum, 6"" wooden or 6' wooden handles Ideal for school crossing guards, flaggers, and plant security guards Wood handle: 6.5"" Short / 6' Long, 7-1/8"" to bottom of sign Aluminum handle 5 3/16"", 14-7/8"" to bottom of sign",,,Short Wood Handle for Alumn. Stop/Slow,Short Wood Handle for Alumn. Stop/Slow
26045,Road Construction Signs,3006555,"48"" Construction Ahead Roll-Up Sign","Construction Ahead VS Mesh- Non-Reflective Roll-Up Signs 48""",E:\IMAGES\ITEMS\product\3\0\Jackson-Safety-3006555-48-Construction-Ahead-Roll-Up.jpg,Jackson Safety,"Construction Ahead VS Mesh- Non-Reflective Roll-Up Signs 48""",Manufactured from tightly woven polyester mesh fabric Specially formulated PVC foam extruded over polyester yarn for a roll-up panel at a very competitive price Features vinyl-coated nylon pocket design. Lexan pockets available upon request at additional cost Silk screened legends and borders,,,"Jackson Safety 3006555 48"" Construction Ahead Roll-Up Sign","48"" Construction Ahead Roll-Up Sign"
26045,Road Construction Signs,3006568,"48"" Flagger Roll-Up Sign",Flagger Symbol Roll-Up Sign,E:\IMAGES\ITEMS\product\3\0\Jackson-Safety-3006568-48-Flagger-Roll-Up.jpg,Jackson Safety,Flagger Symbol Roll-Up Sign,Manufactured from tightly woven polyester mesh fabric Specially formulated PVC foam extruded over polyester yarn for a roll-up panel at a very competitive price Features vinyl-coated nylon pocket design. Lexan pockets available upon request at additional cost Silk screened legends and borders,,,"Jackson Safety 3006568 48"" Flagger Roll-Up Sign","48"" Flagger Roll-Up Sign"
28071,Stop and Go Signs,3006654,"Red/Orange Highway Safety Flag 18"" x 18""","Vinyl Warning Flag (18"" Flag/ 30"" Dowel)",E:\IMAGES\ITEMS\product\3\0\Jackson-Safety-3006654-RedOrange-Highway-Safety-Flag-18-x.jpg,Jackson Safety,"Vinyl Warning Flag (18"" Flag/ 30"" Dowel)",Heat sealed hem Non-Fouling feature and imprinting available Standard pack 50 only,,,"Jackson Safety 3006654 Red/Orange Highway Safety Flag 18"" x 18""","Red/Orange Highway Safety Flag 18"" x 18"""
373|28071,Flags | Paddles|Stop and Go Signs,3007370,"24"" Stop/Slow Sign-Plastic Reflective","Sign Only, STOP/SLOW PDL, 24” ENGINEER GRADE",E:\IMAGES\ITEMS\product\3\0\Jackson-Safety-3007370-24-StopSlow-Sign-Plastic.jpg,Jackson Safety,"Sign Only, STOP/SLOW PDL, 24"" ENGINEER GRADE","Meets MUTCD requirements Octagon shape Paddles available silk screened or reflectorized with Engineer Grade, Hi-Intensity or Diamond Grade sheeting Letter Size: 8"" in 24"" paddle size, 6"" in 18"" paddle size Staff and couplings sold separately PVC handle: Short 21"" / Long 61"" adapter Wood handle: 6' to bottom of sign Aluminum handle: 5-3/16"" to bottom of sign",,,"24"" Stop/Slow Sign-Plastic Reflective","24"" Stop/Slow Sign-Plastic Reflective"
373|28071,Flags | Paddles|Stop and Go Signs,3007481,"24"" Stop/Slow Plastic Sign","PLASTIC HANDLE SET FOR STOP & SLOW (1 LONG, 1 SHORT & HARDWARE)",E:\IMAGES\ITEMS\product\3\0\Jackson-Safety-3007481-Handle-for-24-StopSlow-Plastic.jpg,Jackson Safety,"PLASTIC HANDLE SET FOR STOP & SLOW (1 LONG, 1 SHORT & HARDWARE)","Aluminum silk-screened octagon shaped paddles in 15"" or 18"" size .080 gauge baked aluminum enamel. Available with 6"" aluminum, 6"" wooden or 6' wooden handles Ideal for school crossing guards, flaggers, and plant security guards Wood handle: 6.5"" Short / 6' Long, 7-1/8"" to bottom of sign Aluminum handle 5 3/16"", 14-7/8"" to bottom of sign",,,"24"" Stop/Slow Plastic Sign","24"" Stop/Slow Plastic Sign"
28372,Sign Stands and Hardware,3007719,Tri-Pod Sign Stand For Roll-Up and Rigid Signs,TRI-POD STAND FOR ROLL UP AND RIGID,E:\IMAGES\ITEMS\product\3\0\Jackson-Safety-3007719-Tri-Pod-Sign-Stand-For-Roll-Up-and.jpg,Jackson Safety,TRI-POD STAND FOR ROLL UP AND RIGID,"Meets NCHRP-350 requirements with roll-up sign Displays 36"" and 48"" roll-up or rigid panels without special adaptors Fabricated from durable, galvanized mechanical tubing Powder-coated orange metal signstand Sign stand will withstand winds under 30 MPH Strong, lightweight design allows for easy set-up and take-down",,,Jackson Safety 3007719 Tri-Pod Sign Stand For Roll-Up and Rigid Signs,Tri-Pod Sign Stand For Roll-Up and Rigid Signs
373|28071,Flags | Paddles|Stop and Go Signs,3008822,Hardware Kit for Aluminum Paddle w/ Short Wood Handle,HARDWARE KIT FOR ALUM PADDLES WITH SHORT WOOD HANDLE,E:\IMAGES\ITEMS\product\3\0\Jackson-Safety-3008822-Hardware-Kit-for-Aluminum-Paddle-w.jpg,Jackson Safety,HARDWARE KIT FOR ALUM PADDLES WITH SHORT WOOD HANDLE,"Aluminum silk-screened octagon shaped paddles in 15"" or 18"" size .080 gauge baked aluminum enamel. Available with 6"" aluminum, 6"" wooden or 6' wooden handles Ideal for school crossing guards, flaggers, and plant security guards Wood handle: 6.5"" Short / 6' Long, 7-1/8"" to bottom of sign Aluminum handle 5 3/16"", 14-7/8"" to bottom of sign",,,Hardware Kit for Aluminum Paddle w/ Short Wood Handle,Hardware Kit for Aluminum Paddle w/ Short Wood Handle
167|25838,Face Shields|Hard Hat Face Shields,3010343,V90 Shield,V90 Shield,E:\IMAGES\ITEMS\product\3\0\Jackson-Safety-3010343-V90.jpg,Jackson Safety,V90 Shield,Features Monoggle XTR with full face protection Full face protection detaches from goggle Curved faceshield conforms to shape of face offering better protection Polycarbonate shield for added protection Fits over most prescription eyewear Replacement lenses available Chemical and impact protector,,,Jackson Safety 3010343 V90 Shield,V90 Shield
159|25842,Hard Hats|Hard Hats,3010943,White Western Hat Ratchet Liner-Cowboy Hat,Western Outlaw Hard Hat,E:\IMAGES\ITEMS\product\3\0\Jackson-Safety-3010943-White-Western-Hat-Ratchet-Liner.jpg,Jackson Safety,Western Outlaw Hard Hat,"Meets ANSI Z89.1, Class C and G Stylish, comfortable and fits most head sizes Wide brim for protection against harmful rays 4 pt. ratchet suspension",,,Jackson Safety 3010943 White Western Hat Ratchet Liner-Cowboy Hat,White Western Hat Ratchet Liner-Cowboy Hat
164|25635,Safety Glasses|Safety Glasses,3011375,Nemesis Camo w/ Bronze Lens and Cord,V30 Nemesis.,E:\IMAGES\ITEMS\product\3\0\Jackson-Safety-3011375-Nemesis-Camo-w-Bronze-Lens-and.jpg,Jackson Safety,V30 Nemesis.,"NOW AVAILABLE in new Camo Frame/Lens combos and a hot new Red Frame/Smoke Lens Sleek, sporty style Soft touch temples Lightweight construction Single lens wrap-around protection Includes free neck cord Also available in CSA models Base Curve 8 Select non-polarized Nemesis eyewear available in gravity feed retail display box",,,Jackson Safety 3011375 Nemesis Camo w/ Bronze Lens and Cord,Nemesis Camo w/ Bronze Lens and Cord
26141,High Visibility & Cooling Vests,3012877,M-XL Class 2 Lime 2-Tone Vest,"Deluxe, 2-Tone Lime Mesh Deluxe Vest M-XL",E:\IMAGES\ITEMS\product\3\0\Jackson-Safety-3012877-M-XL-Class-2-Lime-2-Tone.jpg,Jackson Safety,"Deluxe, 2-Tone Lime Mesh Deluxe Vest M-XL","3 Pockets; 2 inside & 1 outside along with shoulder mic/antenna tab 4-Inch split fluorescent trim with 2-inch wide super bright silver retroreflective tape Adjustable panel-belt system for tailored fit over bulky clothes 2 sizes M-XL and 2X-5X Soft, lightweight fluorescent polyester fabric and machine washable Meets ANSI / ISEA 107 - 2004 Class 2 standards",,,M-XL Class 2 Lime 2-Tone Vest,M-XL Class 2 Lime 2-Tone Vest
26141,High Visibility & Cooling Vests,3012878,2X-5X Class 2 Lime 2-Tone Vest Mesh,"Deluxe, 2-Tone Lime Mesh Deluxe Vest 2X-5X",E:\IMAGES\ITEMS\product\3\0\Jackson-Safety-3012878-2X-5X-Class-2-Lime-2-Tone-Vest.jpg,Jackson Safety,"Deluxe, 2-Tone Lime Mesh Deluxe Vest 2X-5X","3 Pockets; 2 inside & 1 outside along with shoulder mic/antenna tab 4-Inch split fluorescent trim with 2-inch wide super bright silver retroreflective tape Adjustable panel-belt system for tailored fit over bulky clothes 2 sizes M-XL and 2X-5X Soft, lightweight fluorescent polyester fabric and machine washable Meets ANSI / ISEA 107 - 2004 Class 2 standards",,,2X-5X Class 2 Lime 2-Tone Vest Mesh,2X-5X Class 2 Lime 2-Tone Vest Mesh
2595|20918,Safety T - Shirts|Shirts,3012947,Large Class 2 Lime T-Shirt Short Sleeve,LIME CL 2 SHORT SLEEVE - L,E:\IMAGES\ITEMS\product\3\0\Jackson-Safety-3012947-Large-Class-2-Lime-T-Shirt-Short.jpg,Jackson Safety,LIME CL 2 SHORT SLEEVE - L,Long sleeves provide additional protection against harmful UV rays Chest pocket with continuous super bright silver retroreflective tape Ribbed collar & cuffs with a stitched hem for added comfort & durability Polyester moisture management fabric wicks away excess moisture Meets ANSI / ISEA 107 - 2004 Class 2 standards,,,Large Class 2 Lime T-Shirt Short Sleeve,Large Class 2 Lime T-Shirt Short Sleeve
2595|20918,Safety T - Shirts|Shirts,3012948,XL Class 2 Lime T-Shirt Short Sleeve,ANSI Class 2 T-Shirt (XL Lime Short Sleeve),E:\IMAGES\ITEMS\product\3\0\Jackson-Safety-3012948-XL-Class-2-Lime-T-Shirt-Short.jpg,Jackson Safety,ANSI Class 2 T-Shirt (XL Lime Short Sleeve),Long sleeves provide additional protection against harmful UV rays Chest pocket with continuous super bright silver retroreflective tape Ribbed collar & cuffs with a stitched hem for added comfort & durability Polyester moisture management fabric wicks away excess moisture Meets ANSI / ISEA 107 - 2004 Class 2 standards,,,XL Class 2 Lime T-Shirt Short Sleeve,XL Class 2 Lime T-Shirt Short Sleeve
2595|20918,Safety T - Shirts|Shirts,3012949,2XL Class 2 Lime T-Shirt Short Sleeve,ANSI Class 2 T-Shirt (2XL Lime Short Sleeve),E:\IMAGES\ITEMS\product\3\0\Jackson-Safety-3012949-2XL-Class-2-Lime-T-Shirt-Short.jpg,Jackson Safety,ANSI Class 2 T-Shirt (2XL Lime Short Sleeve),Long sleeves provide additional protection against harmful UV rays Chest pocket with continuous super bright silver retroreflective tape Ribbed collar & cuffs with a stitched hem for added comfort & durability Polyester moisture management fabric wicks away excess moisture Meets ANSI / ISEA 107 - 2004 Class 2 standards,,,2XL Class 2 Lime T-Shirt Short Sleeve,2XL Class 2 Lime T-Shirt Short Sleeve
2595|20918,Safety T - Shirts|Shirts,3012950,3XL Class 2 Lime T-Shirt Short Sleeve,ANSI Class T-Shirt (3XL Lime Short Sleeve),E:\IMAGES\ITEMS\product\3\0\Jackson-Safety-3012950-3XL-Class-2-Lime-T-Shirt-Short.jpg,Jackson Safety,ANSI Class T-Shirt (3XL Lime Short Sleeve),Long sleeves provide additional protection against harmful UV rays Chest pocket with continuous super bright silver retroreflective tape Ribbed collar & cuffs with a stitched hem for added comfort & durability Polyester moisture management fabric wicks away excess moisture Meets ANSI / ISEA 107 - 2004 Class 2 standards,,,3XL Class 2 Lime T-Shirt Short Sleeve,3XL Class 2 Lime T-Shirt Short Sleeve
166|26691,Goggles|Welding Goggles,3013714,Welding Cup Goggle Shade 5 50MM,V80 Wildcat Cutting Goggle,E:\IMAGES\ITEMS\product\3\0\Jackson-Safety-3013714-Welding-Cup-Goggle-Shade-5.jpg,Jackson Safety,V80 Wildcat Cutting Goggle,"Extreme performance vision protection, material does not melt, drip, or ignite at 350oF for five minutes Dual anti-fog lenses Lightweight and comfortable goggle ideal for any work environment Pivot headband for optimal comfort placement Cushioned eye cups for comfortable fit Adjustable side vents to increase air flow Flame retardant head band",,,Jackson Safety 3013714 Welding Cup Goggle Shade 5 50MM,Welding Cup Goggle Shade 5 50MM
164|25635,Safety Glasses|Safety Glasses,3013854,Hellraiser BLK Frame Smoke Len Safety Glasses,V40 Hellraiser,E:\IMAGES\ITEMS\product\3\0\Jackson-Safety-3013854-Hellraiser-BLK-Frame-Smoke-Len.jpg,Jackson Safety,V40 Hellraiser,"Steamlined, sunglass styling Extreme lightweight design High performance polycarbonate lens Flex point temples for comfort and stability Base Curve 8",,,Hellraiser BLK Frame Smoke Len Safety Glasses,Hellraiser BLK Frame Smoke Len Safety Glasses
164|25635,Safety Glasses|Safety Glasses,3013858,Hellraiser BLK Frame Blue Lens Safety Glasses,V40 Hellraiser,E:\IMAGES\ITEMS\product\3\0\Jackson-Safety-3013858-Hellraiser-BLK-Frame-Blue-Lens.jpg,Jackson Safety,V40 Hellraiser,"Steamlined, sunglass styling Extreme lightweight design High performance polycarbonate lens Flex point temples for comfort and stability Base Curve 8",,,Hellraiser BLK Frame Blue Lens Safety Glasses,Hellraiser BLK Frame Blue Lens Safety Glasses
164|25635,Safety Glasses|Safety Glasses,3016306,Clear Lens Gun Met. Safety Glasses,"Equalizer, Gun Metal Frame, Clear Lens",E:\IMAGES\ITEMS\product\3\0\Jackson-Safety-3016306-Equalizer-Clear-Lens-Gun-Met-Safety.jpg,Jackson Safety,"Equalizer, Gun Metal Frame, Clear Lens","Stylized frames feature a cutting edge design that's ideal for work and play Soft rubber nose pads for superior comfort and fit Sport grip temples eliminates slippage Dual lenses with an 8-base curve that provides wrap-around protection Lens options include anti-scratch or anti-fog coating Complete with micro-fiber carry pouch that doubles as a cleaning cloth High performance polycarbonate lens provides 99.9% UV protection Exceeds the ""High Impact"" level of the ANSI Z87.1+ safety standards",,,Clear Lens Gun Met. Safety Glasses,Clear Lens Gun Met. Safety Glasses
164|25635,Safety Glasses|Safety Glasses,3016307,Clear Anti-Fog Lens. Gun Metal Frame,"Equalizer, Gun Metal Frame, Clear Anti-Fog Lens",E:\IMAGES\ITEMS\product\3\0\Jackson-Safety-3016307-Equalizer-Clear-Anti-Fog-Lens-Gun.jpg,Jackson Safety,"Equalizer, Gun Metal Frame, Clear Anti-Fog Lens","Stylized frames feature a cutting edge design that's ideal for work and play Soft rubber nose pads for superior comfort and fit Sport grip temples eliminates slippage Dual lenses with an 8-base curve that provides wrap-around protection Lens options include anti-scratch or anti-fog coating Complete with micro-fiber carry pouch that doubles as a cleaning cloth High performance polycarbonate lens provides 99.9% UV protection Exceeds the ""High Impact"" level of the ANSI Z87.1+ safety standards Standard Pack 12",,,Clear Anti-Fog Lens. Gun Metal Frame,Clear Anti-Fog Lens. Gun Metal Frame
164|25635,Safety Glasses|Safety Glasses,3016308,Smoke Lens Gun Metal Frames,"Equalizer, Gun Metal Frame, Smoke Anti-Fog Lens",E:\IMAGES\ITEMS\product\3\0\Jackson-Safety3016308-Equalizer-Smoke-Lens-Gun-Metal-Frames.jpg,Jackson Safety,"Equalizer, Gun Metal Frame, Smoke Anti-Fog Lens","Stylized frames feature a cutting edge design that's ideal for work and play Soft rubber nose pads for superior comfort and fit Sport grip temples eliminates slippage Dual lenses with an 8-base curve that provides wrap-around protection Lens options include anti-scratch or anti-fog coating Complete with micro-fiber carry pouch that doubles as a cleaning cloth High performance polycarbonate lens provides 99.9% UV protection Exceeds the ""High Impact"" level of the ANSI Z87.1+ safety standards",,,Smoke Lens Gun Metal Frames,Smoke Lens Gun Metal Frames
164|25635,Safety Glasses|Safety Glasses,3016309,Indoor/Outdoor Gun Metal Safety Glasses,"Equalizer, Gun Metal Frame, Indoor/Outdoor Lens",E:\IMAGES\ITEMS\product\3\0\Jackson-Safety-3016309-Equalizer-IndoorOutdoor-Gun-Metal.jpg,Jackson Safety,"Equalizer, Gun Metal Frame, Indoor/Outdoor Lens","Stylized frames feature a cutting edge design that's ideal for work and play Soft rubber nose pads for superior comfort and fit Sport grip temples eliminates slippage Dual lenses with an 8-base curve that provides wrap-around protection Lens options include anti-scratch or anti-fog coating Complete with micro-fiber carry pouch that doubles as a cleaning cloth High performance polycarbonate lens provides 99.9% UV protection Exceeds the ""High Impact"" level of the ANSI Z87.1+ safety standards",,,Indoor/Outdoor Gun Metal Safety Glasses,Indoor/Outdoor Gun Metal Safety Glasses
