category_ids,category_names,sku,meta_title,meta_description,Image,manufacturer,description,short_description,summary,upc,size_info,meta_keyword
2415|25522,Shoe Covers|Shoe and Boot Covers,36811KC2,A10 Light Duty Blue Shoe Covers,A10 Light Duty Blue Shoe Covers,E:\IMAGES\ITEMS\product\3\6\A10-Light-Duty-Blue-Shoe.jpg,Logistics Supply,,"Features / Specifications 300 per case Lightweight spunbond polypropylene material provides great comfort. Fully elasticized Helps keep workers cool and comfortable in a wide range of work situations, from food processing to manufacturing facilities to hospitals to construction sites",,,Logistics Supply A10 Light Duty Blue Shoe Covers,A10 Light Duty Blue Shoe Covers
159|25842,Hard Hats|Hard Hats,697410,Sunshield for V-Guard,"When their office is outdoors, MSA's Sun Shield Assembly's got it covered ... neck, ears and forehead. Perfect for anyone who works outside in the hot sun, the Sun Shield reduces the risk of skin cancer, thanks to the extended brim, keeping wearers cooler",E:\IMAGES\ITEMS\product\6\9\697410-logistics-Supply-Sunshield-for-V.jpg,Logistics Supply,,"Properties  For V-Gard® Hats Only Extends the brim all the way around to help protect wearer's ears and neck from sun's rays Made of polyurethane (front portion is Lexan, smoke tint)","When their office is outdoors, MSA's Sun Shield Assembly's got it covered ... neck, ears and forehead. Perfect for anyone who works outside in the hot sun, the Sun Shield reduces the risk of skin cancer, thanks to the extended brim, keeping wearers cooler and more comfortable throughout the day. And it's tough, too, thanks to its polyurethane/Lexan® material.",,697410 logistics Supply Sunshield for V-Guard,Sunshield for V-Guard
159|25842,Hard Hats|Hard Hats,10034018,MSA White Cap Fas-Trac Vented,"A hot pick for hot jobs, the V-Gard 500® Cap offers increased airflow and a Glaregard™ anti-reflective brim, making it ideal for warm weather. These caps are designed with lateral contours over the ears as well so it's easy to integrate hearing safeguards",E:\IMAGES\ITEMS\product\1\0\10034018-Logistics-Supply-MSA-White-Cap-Fas-Trac.jpg,Logistics Supply,,"Properties  Vented w/4 and 6 Point Fas-Trac® Ratchet Suspension Consists of a polyethylene shell Provides cooling vents for improved air circulation and comfort Lightweight design for added comfort Lateral contours above the ear for easy integration of hearing protection Glaregard™ underbrim to reduce reflective glare Meets or exceeds the applicable requirements for a Type 1 helmet (top impact) as outlined in ANSI Z89.1-2003, Class C","A hot pick for hot jobs, the V-Gard 500® Cap offers increased airflow and a Glaregard™ anti-reflective brim, making it ideal for warm weather. These caps are designed with lateral contours over the ears as well so it's easy to integrate hearing safeguards. White.",,10034018 Logistics Supply MSA White Cap Fas-Trac Vented,MSA White Cap Fas-Trac Vented
159|25842,Hard Hats|Hard Hats,10087220,V-Guard Suspension,"Properties  4 Point Fas-Trac® Replacement Suspensions For use on Standard (Size: 6 1/2-8), V-Gard® Caps/Hats, and SmoothDome™ Slotted Caps",E:\IMAGES\ITEMS\product\1\0\10087220-Logistics-Supply-V-Guard.jpg,Logistics Supply,,"Properties  4 Point Fas-Trac® Replacement Suspensions For use on Standard (Size: 6 1/2-8), V-Gard® Caps/Hats, and SmoothDome™ Slotted Caps",,,10087220 Logistics Supply V-Guard Suspension,V-Guard Suspension
1326|19703,Cleaning Supplies|Cleaning Supplies Holders,107795SPC,5 Gal Spill Kit,"Universal Allwik Portable Spill Kits, from SPC, are there for an emergency. The Economy Spill Kit™ is stored in a bright-yellow bag so it's highly visible at all times and can absorb five gallons of liquid per kit. The Attack Pac™ is a single-use kit pack",E:\IMAGES\ITEMS\product\1\0\107795SPC-Logistics-Supply-5-Gal-Spill.jpg,Logistics Supply,"Universal Allwik Portable Spill Kits, from SPC, are there for an emergency. The Economy Spill Kit™ is stored in a bright-yellow bag so it's highly visible at all times and can absorb five gallons of liquid per kit. The Attack Pac™ is a single-use kit packed in a silver-color foil bag that's puncture and UV resistant. It absorbs up to seven gallons per each kit.","Contents  10 Pads (15"" x 19"") 2 SOCs (3"" x 4')  1 Disposable Bag Instruction Sheet","Properties  Highly visible yellow PVC bag is ""just right"" for small spills The right price, the right size, and the right value Absorbs up to 5 gallons per kit Accidents happen...Be Prepared with SPC's Emergency Spill Kits",,107795SPC Logistics Supply 5 Gal Spill Kit,5 Gal Spill Kit
159|25842,Hard Hats|Hard Hats,12440EG,Sweat Band,"Hard hats get hot inside, no doubt about it. Chill-Its® Terry Sweatbands from Ergodyne® help alleviate some of the problem by soaking up sweat and keeping it out of the eyes. Chill-Its are made from 100% cotton for superb comfort, it fits most hard hat su",E:\IMAGES\ITEMS\product\1\2\12440EG-Logistics-Supply-Sweat.jpg,Logistics Supply,"Hard hats get hot inside, no doubt about it. Chill-Its® Terry Sweatbands from Ergodyne® help alleviate some of the problem by soaking up sweat and keeping it out of the eyes. Chill-Its are made from 100% cotton for superb comfort, it fits most hard hat suspension systems and are machine washable. One size.","Properties:  Economical way for hard hat wearers to manage moisture Keeps sweat out of eyes Absorbent terry headband Fits most hard hat suspension systems Machine washable 100% cotton Applications: Construction, Trades, Maintenance, Landscaping/Grounds, Assembly/Fabrication, Material Handling, Freight/Baggage, Warehousing/Distribution, Iron/Steel Fabrication",Model Number: 12440 UOM: EA Color: Gray Size: One Size,,12440EG Logistics Supply Sweat Band,Sweat Band
421|25522,Rubber Boots|Shoe and Boot Covers,12BNSCRC,Boot Covers,1.25 oz polypropylene with serged seams and non-skid design. 150 Pair/Case.,E:\IMAGES\ITEMS\product\1\2\12BNSCRC-Logistics-Supply-Boot.jpg,Logistics Supply,1.25 oz polypropylene with serged seams and non-skid design. 150 Pair/Case.,Properties:  150 pair per case Non-skid design,Model Number: 12BNSCRC  UOM: CS  Size: Universal  Color: Blue,,12BNSCRC Logistics Supply Boot Covers,Boot Covers
157|25724,First Aid Kits|First Aid Kits,225ANF,50 Person First Aid Kit,"ANSI First Aid Kits come in multiple combinations and sizes to address different environments. These kits comply with ANSI standards and meet or exceed federal OSHA regulations, too. They also come with a handy list of kit contents for easy ordering and f",E:\IMAGES\ITEMS\product\2\2\225ANF-Logistics-Supply-50-Person-First-Aid.jpg,Logistics Supply,"ANSI First Aid Kits come in multiple combinations and sizes to address different environments. These kits comply with ANSI standards and meet or exceed federal OSHA regulations, too. They also come with a handy list of kit contents for easy ordering and feature labels in both English and Spanish. Contents subject to change without notice.","Kit Includes: (100) 1"" X 3"" Adhesive plastic bandages (3) 1.75"" X 3"" Large fingertip fabric bandages (3) 1.5"" X 3"" Knuckle fabric bandages (2) 2"" X 4"" Elbow & knee plastic bandages (6) 3"" X 3"" Gauze dressing pads, (3) 2-packs (2) 4"" X 4"" Gauze dressing pads, (1) 2-pack (1) 5"" X 9"" Trauma pad (2) 2"" Conforming gauze roll bandages (1) 40"" Triangular sling/bandage, w/2 safety pins (20) Aspirin tablets, (10) 2-packs (12) Alcohol cleansing pads (12) Antiseptic cleansing wipes (sting free) (6) Triple antibiotic ointment packs (6) First aid/burn cream, 0.9 gm. packs (6) Insect sting relief pads (1) 3"" X 5 yd. Latex free elastic bandage (1) .5"" X 5 yd. First aid tape roll (1) 4"" X 5"" Instant cold compress (2) Sterile eye pads (1) Eye wash, 4 oz (4) Exam quality vinyl gloves, 2 pair (1) 4.5"" Scissors, nickel plated (1) 4"" Tweezers, plastic (1) First aid guide","Model Number: 225AN UOM: EA Dimensions: 10.75"" X 11.25"" X 3"" Properties: This 195-piece first aid kit is ideal for contractors, fleet vehicles, worksites or small companies with up to 50 employees It meets federal OSHA recommendations and carries 20 critical products The plastic case, with slanted, spill-proof dividers is wall mountable yet has a handle for easy carrying",,225ANF Logistics Supply 50 Person First Aid Kit,50 Person First Aid Kit
880|27823,Rubber Gloves|Nitrile Gloves,40226 Medium,Medium Purple Nitrile Gloves,"KleenGuard® G40 Purple Nitrile* Foam Coated Gloves deliver a tactile sensitivity and dexterity that translates to excellent gripping power. Improved grip, in turn, translates to improved productivity. The light, seamless, knit nylon liner increases breath",E:\IMAGES\ITEMS\product\K\l\KleenGuard-G40-Purple-Nitrile-Gloves-Logistics.jpg,Logistics Supply,"Sold by the case; 5 bags, 12 pairs/bag. Black/Purple.","Properties:  60 per case Deliver a tactile sensitivity and dexterity that translates to excellent gripping power Improved grip, in turn, translates to improved productivity Light,seamless knit nylon liner for comfort and breathability Elasticized wrists improve safety and security Abrasion resistance rating of 4 out of 4 (EN 388 Standards) Excellent grip even through oil and dirt Black and purple color hides oil and dirt 25% better productivity than leather An excellent choice for any customers in small-parts assembly, materials handling, automotive industries, general maintenance and warehousing/shipping/delivery","KleenGuard® G40 Purple Nitrile* Foam Coated Gloves deliver a tactile sensitivity and dexterity that translates to excellent gripping power. Improved grip, in turn, translates to improved productivity. The light, seamless, knit nylon liner increases breathability for greater comfort and the elasticized wrists improve safety and security. Plus, the durability-boosting purple nitrile coating offers greater protection for hands - scoring four out of four to earn the highest abrasion resistance rating under EN 388. And, these gloves always look fresh on the job, thanks to the black and purple color that masks dirt and oil. Sold by the case; 5 bags, 12 pairs/bag. Black/Purple.",,Medium Purple Nitrile Gloves,Medium Purple Nitrile Gloves
157|25724,First Aid Kits|First Aid Kits,930125PF,25 Person First Aid Kit,This special collection of First Aid Kits are designed to meet the needs of several specific jobs and industries that often require a specialized mix of supplies. Each kit also features English and Spanish labels. Contents subject to change without notice,E:\IMAGES\ITEMS\product\9\3\930125PF-Logistics-Supply-25-Person-First-Aid.jpg,Logistics Supply,This special collection of First Aid Kits are designed to meet the needs of several specific jobs and industries that often require a specialized mix of supplies. Each kit also features English and Spanish labels. Contents subject to change without notice.,"Kit Includes: (100) 1"" X 3"" Adhesive plastic bandages (3) Knuckle fabric bandages (3) Fingertip fabric bandages, large (1) 3"" Conforming gauze roll bandage (1) 40"" Triangular sling/bandage, w/2 safety pins (6) 3"" X 3"" Gauze dressing pads (1) 5"" X 9"" Trauma pad (42) Antiseptic cleansing wipes (sting free) (1) First aid/burn cream pack, 0.9 gm, 10/bx (1) 4"" X 5"" Instant cold compress (1) 1/2"" X 10 yd. First aid tape roll (1) 4.5"" Scissors, nickel plated (1) 4"" Tweezers, plastic, one time use (4) Exam quality gloves, 2 pairs (1) First Aid Guide","Properties: 25 Person,176 Piece Bulk Contractors Kit Plastic Case  Model Number:930125P UOM: EA Size: 9.062"" X 6.313"" X 2.375""",,930125PF Logistics Supply 25 Person First Aid Kit,25 Person First Aid Kit
2596|26161,Protective Coveralls|Work Coveralls,CTL4121,Medium Coveralls,"MicroMAX® and MicroMAX® NS protective clothing can be used in any non-hazardous environment to protect workers from dirt, grime, splashes and more. It’s lightweight and fits easily over clothing allowing for effortless movement. It’s also breathable, and",E:\IMAGES\ITEMS\product\C\o\Coveralls-Logistics.jpg,Logistics Supply,"MicroMAX® and MicroMAX® NS protective clothing can be used in any non-hazardous environment to protect workers from dirt, grime, splashes and more. It's lightweight and fits easily over clothing allowing for effortless movement. It's also breathable, and if it gets wet, it doesn't lose its strength. White. 25/Case.","Properties: 25 per case MicroMax® is the popular alternative to Tyvek! Provides a true aerosol and liquid proof barrier and screens 99% of dry particulates as small as 0.35 microns This economical, protective clothing can be used in any non-hazardous environment to protect workers from dirt, grime, splashes and more Lightweight and fits easily over clothing allowing for effortless movement Breathable to keep workers comfortable all day If it gets wet it doesn't lose its strength Choose from several styles","Model Number:  CTL412, CTL428, CTL414, CTL417 UOM: CS Color: White",,Medium Coveralls,Medium Coveralls
164|25635,Safety Glasses|Safety Glasses,KD110,Safety Spectacles,"The Klondike® Series, from MCR Safety, are stylishly safe glasses at an affordable price. The strong, lightweight polycarbonate lenses filter 99.9% of UV radiation and are coated with scratch-resistant Duramass®. The Klondike® model features a proprietary",E:\IMAGES\ITEMS\product\K\D\KD110-Logistics-Supply-Safety.jpg,Logistics Supply,"The Klondike® Series, from MCR Safety, are stylishly safe glasses at an affordable price. The strong, lightweight polycarbonate lenses filter 99.9% of UV radiation and are coated with scratch-resistant Duramass®. The Klondike® model features a proprietary gel nosepiece and adjustable temples for all-day comfort, too. Meets or exceeds ANSI Z87.1 safety standards.","Properties: Stylishly safe glasses at an affordable price Strong, lightweight polycarbonate lens with scratch-resistant Duramass coating filters out 99.9% of U.V. radiation Gel nose piece and adjustable temples for long-wearing comfort","Model Number: KD114, KD11B, KD110, KD119, KD110AF, KD112, KD112AF, KD119AF, KD113, KD117 UOM: EA Frame Color: Black",,KD110 Logistics Supply Safety Spectacles,Safety Spectacles
168|25541,Eyewash Stations | Accessories|Emergency Eye Wash and Shower Accessories,LCS1C,Lens Cleaning Station,"The Lens Cleaning Station includes two boxes of lens cleaning tissues and one 8 oz bottle of anti-fog, anti-static cleaning spray.",E:\IMAGES\ITEMS\product\L\C\LCS1C-Logistics-Supply-Lens-Cleaning.gif,Logistics Supply,"The Lens Cleaning Station includes two boxes of lens cleaning tissues and one 8 oz bottle of anti-fog, anti-static cleaning spray.","Contains: 2 Boxes containing 300 lens cleaning tissues per box (1) 8 oz bottle of anti-fog, anti-static cleaning spray Cleans a variety of eyewear and is easy to store Reduces fogging and static cling Use for cleaning plastic, polycarbonate, or glass lenses and goggles",Model Number: LCS1 UOM: EA,,LCS1C Logistics Supply Lens Cleaning Station,Lens Cleaning Station
2596|26161,Protective Coveralls|Work Coveralls,CTL4122,Large Coveralls,"MicroMAX® and MicroMAX® NS protective clothing can be used in any non-hazardous environment to protect workers from dirt, grime, splashes and more. It’s lightweight and fits easily over clothing allowing for effortless movement. It’s also breathable, and",E:\IMAGES\ITEMS\product\C\o\Coveralls-Logistics.jpg,Logistics Supply,Large Coveralls,"Properties: 25 per case MicroMax® is the popular alternative to Tyvek! Provides a true aerosol and liquid proof barrier and screens 99% of dry particulates as small as 0.35 microns This economical, protective clothing can be used in any non-hazardous environment to protect workers from dirt, grime, splashes and more Lightweight and fits easily over clothing allowing for effortless movement Breathable to keep workers comfortable all day If it gets wet it doesn't lose its strength Choose from several styles","Model Number:  CTL412, CTL428, CTL414, CTL417 UOM: CS Color: White",,Large Coveralls,Large Coveralls
2596|26161,Protective Coveralls|Work Coveralls,CTL4123,X-Large Coveralls,"MicroMAX® and MicroMAX® NS protective clothing can be used in any non-hazardous environment to protect workers from dirt, grime, splashes and more. It’s lightweight and fits easily over clothing allowing for effortless movement. It’s also breathable, and",E:\IMAGES\ITEMS\product\C\o\Coveralls-Logistics.jpg,Logistics Supply,X-Large Coveralls,"Properties: 25 per case MicroMax® is the popular alternative to Tyvek! Provides a true aerosol and liquid proof barrier and screens 99% of dry particulates as small as 0.35 microns This economical, protective clothing can be used in any non-hazardous environment to protect workers from dirt, grime, splashes and more Lightweight and fits easily over clothing allowing for effortless movement Breathable to keep workers comfortable all day If it gets wet it doesn't lose its strength Choose from several styles","Model Number:  CTL412, CTL428, CTL414, CTL417 UOM: CS Color: White",,X-Large Coveralls,X-Large Coveralls
2596|26161,Protective Coveralls|Work Coveralls,CTL4124,2X-Large Coveralls,"MicroMAX® and MicroMAX® NS protective clothing can be used in any non-hazardous environment to protect workers from dirt, grime, splashes and more. It’s lightweight and fits easily over clothing allowing for effortless movement. It’s also breathable, and",E:\IMAGES\ITEMS\product\C\o\Coveralls-Logistics.jpg,Logistics Supply,2X-Large Coveralls,"Properties: 25 per case MicroMax® is the popular alternative to Tyvek! Provides a true aerosol and liquid proof barrier and screens 99% of dry particulates as small as 0.35 microns This economical, protective clothing can be used in any non-hazardous environment to protect workers from dirt, grime, splashes and more Lightweight and fits easily over clothing allowing for effortless movement Breathable to keep workers comfortable all day If it gets wet it doesn't lose its strength Choose from several styles","Model Number:  CTL412, CTL428, CTL414, CTL417 UOM: CS Color: White",,2X-Large Coveralls,2X-Large Coveralls
880|27823,Rubber Gloves|Nitrile Gloves,40227 Large,Large Purple Nitrile Gloves,"KleenGuard® G40 Purple Nitrile* Foam Coated Gloves deliver a tactile sensitivity and dexterity that translates to excellent gripping power. Improved grip, in turn, translates to improved productivity. The light, seamless, knit nylon liner increases breath",E:\IMAGES\ITEMS\product\K\l\KleenGuard-G40-Purple-Nitrile-Gloves-Logistics.jpg,Logistics Supply,Large Purple Nitrile Gloves,"Properties:  60 per case Deliver a tactile sensitivity and dexterity that translates to excellent gripping power Improved grip, in turn, translates to improved productivity Light,seamless knit nylon liner for comfort and breathability Elasticized wrists improve safety and security Abrasion resistance rating of 4 out of 4 (EN 388 Standards) Excellent grip even through oil and dirt Black and purple color hides oil and dirt 25% better productivity than leather An excellent choice for any customers in small-parts assembly, materials handling, automotive industries, general maintenance and warehousing/shipping/delivery","KleenGuard® G40 Purple Nitrile* Foam Coated Gloves deliver a tactile sensitivity and dexterity that translates to excellent gripping power. Improved grip, in turn, translates to improved productivity. The light, seamless, knit nylon liner increases breathability for greater comfort and the elasticized wrists improve safety and security. Plus, the durability-boosting purple nitrile coating offers greater protection for hands - scoring four out of four to earn the highest abrasion resistance rating under EN 388. And, these gloves always look fresh on the job, thanks to the black and purple color that masks dirt and oil. Sold by the case; 5 bags, 12 pairs/bag. Black/Purple.",,Large Purple Nitrile Gloves,Large Purple Nitrile Gloves
236|25808,Latex | Coated Gloves|Coated Gloves,97271,Kleenguard G40 Latex,,E:\IMAGES\ITEMS\product\9\7\Logistics-Supply-97271-Kleenguard-G40.jpg,Logistics Supply,Logistics Supply 97271 Kleenguard G40 Latex,"Manufactured to minimize latex proteins. Highest tear rating of 4 out of 4 (EN388). Enhanced dexterity. Breathable cotton back. Crinkled latex for excellent grip. Applications: Masonry,Materials handling, General maintenance, Warehousing/Shipping/Delivery.","Designed for excellent durability in the work environment, these general purpose poly-cotton latex coated gloves are processed to yield lower latex proteins. An excellent value, they offer good grip as well as great comfort and dexterity. Great for masonry applications.",,Medium,Kleenguard G40 Latex
168|25541,Eyewash Stations | Accessories|Emergency Eye Wash and Shower Accessories,24300PK,"Eye Flush Station, Twin (32 oz)",,E:\IMAGES\ITEMS\product\2\4\Eye-Flush-Station-Twin-32.jpg,Logistics Supply,,These secondary Eyewash Stations provide easy access for a quick response to eye accidents. The smaller size of these stations makes them ideal for placement closer to hazardous areas for immediate response. The removable bottles are also perfect for portable use when transporting an injured worker to a facility for further medical care.,,,"Eye Flush Station, Twin (32 oz)","Eye Flush Station, Twin (32 oz)"
25842,Hard Hats,475395,Hard Hat Skullgard,,E:\IMAGES\ITEMS\product\4\7\logistics-supply-475395-hard-hat-skullgard.jpg,Logistics Supply,Skullgard Protective Cap,,"Heavy-duty construction makes these the clear choice for working in high-temperature environments, up to but not exceeding 350°F. They're perfect for workers in steel mills and other heavy industries.",,Standard,Hard Hat Skullgard
25842,Hard Hats,475407,Hard Hat Skullgard,,E:\IMAGES\ITEMS\product\4\7\logistics-supply-475407-hard-hat-skullgard.jpg,Logistics Supply,Skullgard Protective Cap,,"Heavy-duty construction makes these the clear choice for working in high-temperature environments, up to but not exceeding 350°F. They're perfect for workers in steel mills and other heavy industries.",,Full,Hard Hat Skullgard
25841,Hard Hat Suspensions,478334,Hard Hat Susp Skullg,,E:\IMAGES\ITEMS\product\4\7\logistics-supply-478334-hard-hat-susp-skullg.jpg,Logistics Supply,Replacement Fas-Trac Suspensions,,,,Standard,Hard Hat Susp Skullg
25841,Hard Hat Suspensions,478454,Hard Hat Susp Skullg,,E:\IMAGES\ITEMS\product\4\7\logistics-supply-478454-hard-hat-susp-skullg.jpg,Logistics Supply,Replacement Fas-Trac Suspensions,,,,Large,Hard Hat Susp Skullg
19729,Personal Care Hand Cleaner,10155WD,Lava Liquid W/Pump,,E:\IMAGES\ITEMS\product\1\0\logistics-supply-10155wd-lava-liquid-wpump.jpg,Logistics Supply,Lava Liquid Hand Cleaner,,"Lava is the original Heavy-Duty Hand Cleaner. Setting the standard for hand cleaning since 1893, Lava’s pumice-powered liquid soap gets super-dirty hands really clean. It removes dirt, grease, oil, ink, tar, paint, caulk, and adhesives.",,1 Gal,Lava Liquid W/Pump
25629|25635,Polarized Safety Glasses|Safety Glasses,25676KC2,Glasses Nemesis,,E:\IMAGES\ITEMS\product\2\5\logistics-supply-25676kc2-glasses-nemesis.jpg,Logistics Supply,Nemesis Eyewear,,"Eyewear offers a sporty look, on or off the job, in a lightweight design with flex temples. They also provide wraparound protection and come with a neck cord to keep them handy. Meets ANSI impact standards and blocks 99.99% of harmful UV rays",,Clear,Glasses Nemesis
25629|25635,Polarized Safety Glasses|Safety Glasses,3000356JS,Glasses Nemesis,,E:\IMAGES\ITEMS\product\3\0\logistics-supply-3000356js-glasses-nemesis.jpg,Logistics Supply,Nemesis Eyewear,,"Eyewear offers a sporty look, on or off the job, in a lightweight design with flex temples. They also provide wraparound protection and come with a neck cord to keep them handy. Meets ANSI impact standards and blocks 99.99% of harmful UV rays",,Black/Smoke,Glasses Nemesis
25629|25635,Polarized Safety Glasses|Safety Glasses,3000357JS,Glasses Nemesis,,E:\IMAGES\ITEMS\product\3\0\logistics-supply-3000357js-glasses-nemesis.jpg,Logistics Supply,Nemesis Eyewear,,"Eyewear offers a sporty look, on or off the job, in a lightweight design with flex temples. They also provide wraparound protection and come with a neck cord to keep them handy. Meets ANSI impact standards and blocks 99.99% of harmful UV rays",,Black; In/Outdoor Wear,Glasses Nemesis
25629|25635,Polarized Safety Glasses|Safety Glasses,3011373JS,Glasses Nemesis,,E:\IMAGES\ITEMS\product\3\0\logistics-supply-3011373js-glasses-nemesis.jpg,Logistics Supply,Nemesis Eyewear,,"Eyewear offers a sporty look, on or off the job, in a lightweight design with flex temples. They also provide wraparound protection and come with a neck cord to keep them handy. Meets ANSI impact standards and blocks 99.99% of harmful UV rays",,Blue/Light Blue,Glasses Nemesis
25690,Fire Extinguishers,76222BY,6 X 3 FIRE EXTINGUISHER INSPECTION TAG,,E:\IMAGES\ITEMS\product\7\6\logistics-supply-76222by-6-x-3-fire-extinguisher-inspection-tag.jpg,Logistics Supply,"Printed on economy polyester with grommets. Includes fasteners. 5 3/4"" x 3"". 25/Pkg.",,,,,6 X 3 FIRE EXTINGUISHER INSPECTION TAG
25936,Sports Drinks and Thirst Quenchers,060100SQ,ORANGE SQWINCHER QWIK STICKS 50 PACKS/BG,,E:\IMAGES\ITEMS\product\0\6\logistics-supply-060100sq-orange-sqwincher-qwik-sticks-50-packsbg.jpg,Logistics Supply,"Sqwincher Qwik Stiks are sugar free and convenient because they can quickly be added to 20 oz. of bottled water, or to a 20 oz. cup. These Stiks make staying hydrated while you work or play sports easy and simple. The Lite Qwik Stiks are designed with the health concious and diabetic in mind with no sugars and no carbs. This economical product comes in a orange flavor and it is sold by the case which contains 500 packs.",,Disolves in Water Restores Electrolytes and Fluid Balance,,,ORANGE SQWINCHER QWIK STICKS 50 PACKS/BG
