category_ids,category_names,sku,meta_title,meta_description,Image,manufacturer,description,short_description,summary,upc,size_info,meta_keyword
25936,Sports Drinks and Thirst Quenchers,060102SQ,FRUIT PUNCH SQWINCHER QWIK STICKS 50 PACKS/BG,,E:\IMAGES\ITEMS\product\0\6\logistics-supply-060102sq-fruit-punch-sqwincher-qwik-sticks-50-packsbg.jpg,Logistics Supply,"Sqwincher Qwik Stiks are sugar free and convenient because they can quickly be added to 20 oz. of bottled water, or to a 20 oz. cup. These Stiks make staying hydrated while you work or play sports easy and simple. The Lite Qwik Stiks are designed with the health concious and diabetic in mind with no sugars and no carbs. This economical product comes in a orange flavor and it is sold by the case which contains 500 packs.",,Disolves in Water Restores Electrolytes and Fluid Balance,,,FRUIT PUNCH SQWINCHER QWIK STICKS 50 PACKS/BG
25936,Sports Drinks and Thirst Quenchers,060106SQ,LEMON LIME SQWINCHER QWIK STICKS 50 PACKS/BG,,/,Logistics Supply,"Sqwincher Qwik Stiks are sugar free and convenient because they can quickly be added to 20 oz. of bottled water, or to a 20 oz. cup. These Stiks make staying hydrated while you work or play sports easy and simple. The Lite Qwik Stiks are designed with the health concious and diabetic in mind with no sugars and no carbs. This economical product comes in a orange flavor and it is sold by the case which contains 500 packs.",,Disolves in Water Restores Electrolytes and Fluid Balance,,,LEMON LIME SQWINCHER QWIK STICKS 50 PACKS/BG
26101,Traffic Delineator Posts and Channelizers,DP42TF,"45"" DELINEATOR W/ 13 LB BASE & REFLECTIVE BAND",,E:\IMAGES\ITEMS\product\D\P\logistics-supply-dp42tf-45-delineator-w-13-lb-base-reflective-band.jpg,Logistics Supply,"Featuring a two-piece design and a heavy base to help it withstand passing traffic, this delineator also has a reflective band and T-top to hold a standard barricade light or barricade tape. 13 lb. 45"". Fluorescent Orange.",,,,,"45"" DELINEATOR W/ 13 LB BASE & REFLECTIVE BAND"
25841,Hard Hat Suspensions,10148708,>SUSPENSION ONLY< FOR V-GARD HAT/CAP 10087220,,E:\IMAGES\ITEMS\product\1\0\logistics-supply-10148708-suspension-only-for-v-gard-hatcap-10087220.jpg,Logistics Supply,Suspensions feature flush rear lug attachments to eliminate pressure points. They also come with three levels of nape strap adjustment for a customized fit.  Suspensions feature flush rear lug attachments to eliminate pressure points. They also come with three levels of nape strap adjustment for a customized fit.,,,,,>SUSPENSION ONLY< FOR V-GARD HAT/CAP 10087220
25841,Hard Hat Suspensions,697290,SUNSHIELD FOR CAP STYLE MSA HARD CAP,,E:\IMAGES\ITEMS\product\6\9\logistics-supply-697290-sunshield-for-cap-style-msa-hard-cap.png,Logistics Supply,"Sunshields protect the neck and ears, reducing the risk of skin cancer, thanks to the extended brim that also keep wearers cooler and more comfortable. And they're made of tough polyurethane and Lexan™ for extra durability.",,,,,SUNSHIELD FOR CAP STYLE MSA HARD CAP
