category_ids,category_names,sku,meta_title,meta_description,Image,manufacturer,description,short_description,summary,upc,size_info,meta_keyword
2717|21838,Rulers & Straight Edges|Rules and Straight Edges,1066D,"6"" Engineers Folding Wood Ruler","Red foot figures; regular outside markings in feet and inches. Decimal points on engineer's scale prevent reading errors. Graduated in feet, 1/10ths and 1/100ths of feet.",E:\IMAGES\ITEMS\product\0\6\066D-Lufkin-6-Engineers-Folding-Wood.jpg,Lufkin,"Red foot figures; regular outside markings in feet and inches. Decimal points on engineer's scale prevent reading errors. Graduated in feet, 1/10ths and 1/100ths of feet.",WOOD -W/SCALE Wdth In x Lgth Ft=5/8 x 6,,,"066D Lufkin 6"" Engineers Folding Wood Ruler","6"" Engineers Folding Wood Ruler"
2716|27969,Tape Measure|Tape Measures,HW100,100' Tape Rule,,E:\IMAGES\ITEMS\product\H\W\HW100-Lufkin-100-Tape.jpg,Lufkin,,"Vinyl covered steel case with yellow clad blade .005"" thick blade. Large easy action winding drum with friction washers. Fitted with a folding hook ring. Graduated feet and inches to 1/8ths with instantaneous readings; 16"" centers indicated by a diamond.","Steel Case Size - 3/8"" x 100' Blade Style - B1",,HW100 Lufkin 100' Tape Rule,100' Tape Rule
2716|27969,Tape Measure|Tape Measures,PS3435,"35' x 1"" Pro Tape Rule",Rubber cushion shell protects tape from impact and improves grip while Ny-Clad blade coating extends blade life. Removable belt clip. End hook lasts longer than ordinary end hooks and non-slip toggle lock allows complete control of power tape blade.,E:\IMAGES\ITEMS\product\P\S\PS3435-Lufkin-35-x-1-Pro-Tape.jpg,Lufkin,Rubber cushion shell protects tape from impact and improves grip while Ny-Clad blade coating extends blade life. Removable belt clip. End hook lasts longer than ordinary end hooks and non-slip toggle lock allows complete control of power tape blade.,"Rubber Case Pro Series 3000 Power Return Blade Size: 1"" x 35' Blade Style: A5",,,"PS3435 Lufkin 35' x 1"" Pro Tape Rule","35' x 1"" Pro Tape Rule"
2716|27969,Tape Measure|Tape Measures,HW50,"3/8"" x 50' Yellow Tape",,E:\IMAGES\ITEMS\product\H\W\Lufkin-HW50-38-x-50-Yellow.jpg,Lufkin,,"Professional tradesman's quality Rugged, vinyl-covered steel case Yellow clad tape; 3/8""/10mm wide and .008""/0.2mm thick Large easy action winding drum and friction washers Nylon rollers guide the tape smoothly in and out of case",,,"Lufkin HW50 3/8"" x 50' Yellow Tape","3/8"" x 50' Yellow Tape"
27969,Tape Measures,100L,LUFKIN 100L 3/8X100 TAPE MEASURE LONG UNIVERSAL,,E:\IMAGES\ITEMS\product\1\0\lufkin-100l-lufkin-100l-38x100-tape-measure-long-universal.jpg,Lufkin,"This LUFKIN long tape measure has a high-impact Hi-Viz® orange case that’s easy to locate on the jobsite. The 2-sided end hook allows use with either scale, plus it stores in the contoured mouth of the case for ready access. Model includes a removable belt clip.",The Lufkin Universal tape is great for general purpose long distance measuring. The yellow clad steel blade and the signature Hi-Viz orange case can be easily found on nearly any job site.,High-impact polystyrene case for increased durability Easy-wind nylon drum for quick retraction,3710345100.0,"3/8”W x 100’L, .005” thick Hi-Viz® orange case, yellow clad blade Easy-to-read black and red markings Hook ring is retained neatly in the contoured mouth of the case Removable belt clip B1 blade: 8ths </ul",LUFKIN 100L 3/8X100 TAPE MEASURE LONG UNIVERSAL
21838,Rules and Straight Edges,1066DN,LUFKIN 1066DN 6 ENGINEERS FOLDING WOOD RULE 5/8X6 RED END,,E:\IMAGES\ITEMS\product\1\0\lufkin-1066dn-lufkin-1066dn-6-engineers-folding-wood-rule-58x6-red-end.jpg,Lufkin,"Since 1869, Crescent Lufkin® has stood at the forefront of measuring tools and equipment, with industy-leading quality and innovation. We enable the consumer or professional user with reliable, precise, durable lines of products, including our wooden measuring rules. Since patenting the Lufkin Folding Rule in 1919, we've been manufacturing top-quality tools, like this rule which features brass joints, clear graduation markings, and highly visible red root figures.",,"5/8"" X 6' Red End® Engineer's Scale Wood Rule Graduated in Feet, 1/10Ths and 1/100Ths of Feet Red Foot Figures Regular Outside Markings in Feet, Inches and 1/16Ths Decimal Points on Engineers Scale Prevent Reading Errors Prop 65 compliant",3710326551.0,,LUFKIN 1066DN 6 ENGINEERS FOLDING WOOD RULE 5/8X6 RED END
,,2024CME,LUFKIN 2024CME TAPE 1/2x12 (13MMX4M) SERIES 2000,,/,Lufkin,"Lufkin® Tape Measure, Series: 2000, Measuring System: Imperial/Metric, 13 ft Blade Length, 1/2 in Blade Width, Steel Blade, Graduations: 1/16ths, 1 mm, Black/Red Markings, Automatic Rewind, Toggle Locking, Quad Hook® with 4 Rivets Hook, Closed Case, Chrome Case",,"Case Designed to Fit Perfectly in the Hand Lightweight, High Strength Chrome Finished Case Fits Easily Into Most Tape Holsters Bright Yellow Blade Has Clear Easy-To-Read Numerals Toggle Lock Positioned for Convenient Operation, Holds Blade Securely Cushioned Blade Return Removable Belt Clip All Shelf Pack Power Tapes Are Carded Blade Style: A13",3710310399.0,,LUFKIN 2024CME TAPE 1/2x12 (13MMX4M) SERIES 2000
27969,Tape Measures,50,LUFKIN 50 3/8X50 TAPE MEASURE LONG UNIVERSAL,,E:\IMAGES\ITEMS\product\5\0\lufkin-50-lufkin-50-38x50-tape-measure-long-universal.jpg,Lufkin,The Lufkin Universal Lightweight tape is great for general purpose long distance measuring. The yellow clad steel blade has easy-to-read black and red measurement markings. The signature Hi-Viz orange case can be easily found on nearly any job site.,The Lufkin Universal tape is great for general purpose long distance measuring. The yellow clad steel blade and the signature Hi-Viz orange case can be easily found on nearly any job site.,High-impact polystyrene case for increased durability Easy-wind nylon drum for quick retraction,3710345068.0,"3/8"" x 50' Hi-Viz® Orange Universal Lightweight Yellow Clad Tape Measure Contoured case stores hook ring for protection during storage Clear coat blade protection prolongs blade life Tuck away handle for protection duri",LUFKIN 50 3/8X50 TAPE MEASURE LONG UNIVERSAL
21838,Rules and Straight Edges,636,LUFKIN 636 WOOD RULE BRICK MASON 5/8X6,,E:\IMAGES\ITEMS\product\6\3\lufkin-636-lufkin-636-wood-rule-brick-mason-58x6.jpg,Lufkin,"Ten different brick spacing scales on one side;-Inches, 8ths and 16ths on the other side. Course counter quickly tells you how many courses you have marked off or laid up.",,"Lufkin, 6' Red End Rugged Brick Masons Wood Rule For Spacing Brick Courses. Graduated vertical inches to 1/16ths, both edges Brick Mason's scale on inside, red course counters numbered consecutively Regular outside markings in black Using the LufkinÂ® "" Red End"" 636 Brick Mason's Rule is easy and fast Length 6 ft   Width 5/8 in   Increment @ Scale 1/16 in @ 1 in   No. of Scales 2   Specialty Scales Standard Brick   Material Wood   Finish Lacquer   Measuring System Inch   Type Folding Rule",3710345344.0,,LUFKIN 636 WOOD RULE BRICK MASON 5/8X6
21838,Rules and Straight Edges,646L,LUFKIN 646L FOLDING RULE 6 MODULAR SPACING MASONRY,,E:\IMAGES\ITEMS\product\6\4\lufkin-646l-lufkin-646l-folding-rule-6-modular-spacing-masonry.jpg,Lufkin,"Six different scales on one side;-Inches, 8ths and 16ths on the other. Every joint opens on even numbers. Fine for 6 or 12-Inch glass blocks.",,"All sections have square ends Every joint opens on even number Inside marked with 6 scales in a 16"" module Outside is graduated on both edges to 1/16ths The first end section is a short section Permits butting the rule on the first 16"" module",3710345345.0,,LUFKIN 646L FOLDING RULE 6 MODULAR SPACING MASONRY
21838,Rules and Straight Edges,966N,LUFKIN 966N 6 FOLDING WOOD RULE TWO-WAY,,E:\IMAGES\ITEMS\product\9\6\lufkin-966n-lufkin-966n-6-folding-wood-rule-two-way.jpg,Lufkin,"Since 1869, Crescent Lufkin® has stood at the forefront of measuring tools and equipment, with industry-leading quality and innovation. We enable the consumer or professional user with reliable, precise, durable lines of products, including our wooden measuring rules. Since patenting the Lufkin Folding Rule in 1919, we've been manufacturing top-quality tools, like this rule which features brass joints, clear graduation markings that measure in both directions, and flat inside markings.",,"5/8"" x 6' Red End® Two Way® Wood Rule For Measuring Left to Right and Right to Left Marked on both sides for versatile use Graduations in feet, inches and 1/16ths on both edges of both sides Flat inside markings lie close to the work Durable construction with strong, brass plated joints and brass end caps to prevent ends from splintering",3710326556.0,,LUFKIN 966N 6 FOLDING WOOD RULE TWO-WAY
27969,Tape Measures,FE100,LUFKIN FE100 1/2X100 FIBERGLASS OPEN REEL TAPE,,E:\IMAGES\ITEMS\product\F\E\lufkin-fe100-lufkin-fe100-12x100-fiberglass-open-reel-tape.jpg,Lufkin,"The Crescent Lufkin® Fiberglass Long Tapes are ideal for measuring long distances around your home or on the job. Available in multiple lengths and blade print styles, the long tapes are designed to be durable and long lasting, regardless of the application they're used for.",,Open four arm frame design protects blade without trapping dirt in the case Lightweight case for easy handling and transport Dual material grip elevated above the reel prevents contact between the reel and your knuckles Versatile folding end hook for use in multiple applications Rewind Reel tucks away for protection during storage,3710322405.0,"1/2"" x 100' Hi-Viz® Orange Fiberglass Tape Measure Feet and inches graduated to 1/8ths Blade style: C1",LUFKIN FE100 1/2X100 FIBERGLASS OPEN REEL TAPE
27969,Tape Measures,FE100D,LUFKIN FE100D 1/2X100 FIBERGLASS TAPE OPEN REEL SURVEYING ENGINEERS,,E:\IMAGES\ITEMS\product\F\E\lufkin-fe100d-lufkin-fe100d-12x100-fiberglass-tape-open-reel-surveying-engineers.jpg,Lufkin,"The Crescent Lufkin® Fiberglass Long Tapes are ideal for measuring long distances around your home or on the job. Available in multiple lengths and blade print styles, the long tapes are designed to be durable and long lasting, regardless of the application they're used for.",,Open four arm frame design protects blade without trapping dirt in the case Lightweight case for easy handling and transport Dual material grip elevated above the reel prevents contact between the reel and your knuckles Versatile folding end hook for use in multiple applications Rewind Reel tucks away for protection during storage,3710322402.0,"1/2"" x 100' Hi-Viz® Orange Engineer's Fiberglass Tape Measure Engineer's blade has feet, 10th, and 100th of feet graduations Blade style: C2",LUFKIN FE100D 1/2X100 FIBERGLASS TAPE OPEN REEL SURVEYING ENGINEERS
27969,Tape Measures,FE200,LUFKIN FE200 1/2X200 OPEN REEL FIBERGLASS TAPE,,E:\IMAGES\ITEMS\product\F\E\lufkin-fe200-lufkin-fe200-12x200-open-reel-fiberglass-tape.jpg,Lufkin,"The Crescent Lufkin® Fiberglass Long Tapes are ideal for measuring long distances around your home or on the job. Available in multiple lengths and blade print styles, the long tapes are designed to be durable and long lasting, regardless of the application they're used for.",,Open four arm frame design protects blade without trapping dirt in the case Lightweight case for easy handling and transport Dual material grip elevated above the reel prevents contact between the reel and your knuckles Versatile folding end hook for use in multiple applications Rewind Reel tucks away for protection during storage,3710322409.0,"1/2"" x 200' Hi-Viz® Orange Fiberglass Tape Measure Feet and inches graduated to 1/8ths Blade style: C1",LUFKIN FE200 1/2X200 OPEN REEL FIBERGLASS TAPE
27969,Tape Measures,FE300,LUFKIN FE300 1/2X300 FIBERGLASS OPEN REEL TAPE,,E:\IMAGES\ITEMS\product\F\E\lufkin-fe300-lufkin-fe300-12x300-fiberglass-open-reel-tape.jpg,Lufkin,"The Crescent Lufkin® Fiberglass Long Tapes are ideal for measuring long distances around your home or on the job. Available in multiple lengths and blade print styles, the long tapes are designed to be durable and long lasting, regardless of the application they're used for.",,Open four arm frame design protects blade without trapping dirt in the case Lightweight case for easy handling and transport Dual material grip elevated above the reel prevents contact between the reel and your knuckles Versatile folding end hook for use in multiple applications Rewind Reel tucks away for protection during storage,3710322411.0,"1/2"" x 300' Hi-Viz® Orange Fiberglass Tape Measure Feet and inches graduated to 1/8ths Blade style: C1",LUFKIN FE300 1/2X300 FIBERGLASS OPEN REEL TAPE
27969,Tape Measures,HV1048CM,LUFKIN HV1048CM TAPE 25MMX8M SERIES 1000 HI-VIZ ORANGE,,E:\IMAGES\ITEMS\product\H\V\lufkin-hv1048cm-lufkin-hv1048cm-tape-25mmx8m-series-1000-hi-viz-orange.jpg,Lufkin,"""HI-VIZ"" SERIES 1000 POWER TAPE Blade Length: 8 m Blade Width: 25 mm Blade Style: A9 Measuring System: Metric Increment @ Scale: 1 mm @ 1 dm No. of Scales: 1 Blade Material: Steel Blade Finish: Yellow Clad End Type: Hook w/Burr Color: Orange Mounting: Belt Clip Hi-Viz case - easy to find on the job Case designed to fit perfectly in the hand Lightweight, high strength case Fits easily into most tape holsters Bright yellow blade has clear easy-to-read numerals Toggle lock is positioned for convenient operation and holds the blade securely in any position Virtually unbreakable Quad Hook Cushioned blade return Removable belt clip",,"Blade Length: 8 m ,Blade Width: 25 mm ,Blade Style: A9 Measuring System: Metric ,Increment @ Scale: 1 mm @ 1 dm No. of Scales: 1 ,Blade Material: Steel Blade Finish: Yellow Clad ,End Type: Hook w/Burr Color: Orange ,Mounting: Belt Clip",3710310554.0,,LUFKIN HV1048CM TAPE 25MMX8M SERIES 1000 HI-VIZ ORANGE
27969,Tape Measures,HV1425D,LUFKIN HV1425D 1X25 ENGINEERS TAPE HI-VIZ,,E:\IMAGES\ITEMS\product\H\V\lufkin-hv1425d-lufkin-hv1425d-1x25-engineers-tape-hi-viz.jpg,Lufkin,"Since 1869 Lufkin has been manufacturing and supplying top-quality measuring tools with very high accuracy. True to their reputation, the Hi-Viz series power return tape measure is precise in its measurements and durable in its materials and design. Designed to fit perfectly into your hand, the closed case is made from super-strong, lightweight, ABS plastic that has an eye-catching color so it's easy to find. The 1"" wide yellow blade is made of steel with a clear coat for excellent visibility. The numerals are in a clear, easy-to-read font. This engineer's tape has the A4 style blade. It is 33' (10.06m) long with 2 sets of graduations. On the top edge the measurements are given in ft/10ths/100ths, while the bottom edge is graduated by ft/in/16ths. This tape measure is a self-rewind with its power return. There is a special cushion for the blade return so as to prevent injury. It also has a toggle lock feature so that you don't have the blade return while reading. As added benefits, there is a virtually unbreakable quad hook at the end of the blade, and a convenient, removable belt hook.",,Easy to find Small enough to fit in your hand Lightweight Easy-to-read blade Toggle lock Extra durable Cushioned for blade power return Removable belt clip Measures inches/10ths/100ths,3710306335.0,,LUFKIN HV1425D 1X25 ENGINEERS TAPE HI-VIZ
27969,Tape Measures,HW223,LUFKIN HW223 3/8X50 BANNER TAPE MEASURE LONG BLADE,,E:\IMAGES\ITEMS\product\H\W\lufkin-hw223-lufkin-hw223-38x50-banner-tape-measure-long-blade.jpg,Lufkin,"3/8"" x 50' Banner® Yellow Clad Tape Measure",,"Professional Tradesman’s Quality Rugged, Vinyl-Covered Steel Case Yellow Clad Tape; 3/8""/10mm Wide and .008""/0.2mm Thick Large Easy Action Winding Drum and Friction Washers Nylon Rollers Guide the Tape Smoothly in and Out of Case Bold Graduations with Black and Red Numbers for Accurate Measuring H Prefix Denotes Product Blade is Fitted with A Folding Hook Ring Blade Style: B1",3710345886.0,,LUFKIN HW223 3/8X50 BANNER TAPE MEASURE LONG BLADE
27969,Tape Measures,L1035MAG,LUFKIN L1035MAG 1-3/16X35 COMMAND SERIES MAGNETIC TAPE MEASURE DUAL S,,E:\IMAGES\ITEMS\product\L\1\lufkin-l1035mag-lufkin-l1035mag-1-316x35-command-series-magnetic-tape-measure-dual-s.jpg,Lufkin,"The Crescent Lufkin® L1000 Command Series tapes are a line of tough tape measures for the professional user. Their design is compact, comfortable, and are our most durable tape family. The nylon-coated yellow-clad blade has large, easy-to-read markings on both sides of the tape, allowing you to see measurements from all angles, and boasts a 10-foot standout. The 4-rivet magnetic dual end hook grips on all sides and makes marking and measuring significantly easier. The tape has a rugged rubber over-mold for increased impact resistance.",,"1-3/16"" x 35' L1000 Command Series Magnetic Yellow Clad Dual Sided Tape Measure Compact case designed for improved ergonomics 1-3/16"" dual sided blade with a vertical read on the back side Consecutive graduation of inches to 16ths on both sides, with a vertical and a horizontal read out 10-foot standout for longer reach and efficient measuring 360° magnetic end hook grips on all sides to make marking and measuring easier Nylon-coated, anti-glare blade protection prolongs the life of the blade Rugged rubber over-mold housing has a 5-screw construction for increased impact resistance Strong magnet on end hook for convenience Tether point for safely working at height",3710331354.0,,LUFKIN L1035MAG 1-3/16X35 COMMAND SERIES MAGNETIC TAPE MEASURE DUAL S
27969,Tape Measures,L1125,LUFKIN L1125 1-3/16X25 SHOCKFORCE TAPE METAL GUARDRAILS FOR LOCK BUTTO,,E:\IMAGES\ITEMS\product\L\1\lufkin-l1125-lufkin-l1125-1-316x25-shockforce-tape-metal-guardrails-for-lock-butto.jpg,Lufkin,"Introducing the toughest tapes to ever hit a jobsite. Shockforce brings new meaning to the term high performance with a full 14 Ft. of standout and the ability to survive a 100 Ft. drop onto solid concrete. Add in a diamond coated 360-degree end hook that delivers 50% more gripping power, a two-sided blade with vertical markings on the back, and class-leading ergonomics and you have a tape that’s destined to be the new standard for trade professionals.",Introducing the toughest tapes to ever hit a jobsite. Shockforce brings new meaning to the term high performance with a full 14 Ft. of standout and the ability to survive a 100 Ft. drop onto solid concrete. Add in a diamond coated 360-degree end hook that,"Diamond-coated end hook grabs material from every direction and prevents slippage Narrow blade technology offers reduced weight when carrying a tape all day on the job site Matte nylon blade provides extended product life and glare reduction Optimized drum and spring design provides a compact case design that fits comfortably in the palm of your hand Survives a 100' drop for real life, on the job durability Dual-sided blade print with vertical quick read scale on underside for overhead and hard to reach measurements 14 feet of unassisted standout Steel tether point offers increased safety capability when working at height Steel tether point can also be used for scribing and drawing arcs during layout",37103328304.0,"1-3/16"" x 25' Shockforce Dual Sided Tape Measure",LUFKIN L1125 1-3/16X25 SHOCKFORCE TAPE METAL GUARDRAILS FOR LOCK BUTTO
27969,Tape Measures,L1125B,LUFKIN L1125B 25X1-3/16 NITE EYE TAPE MEASURE BLACK BLADE,,E:\IMAGES\ITEMS\product\L\1\lufkin-l1125b-lufkin-l1125b-25x1-316-nite-eye-tape-measure-black-blade.jpg,Lufkin,"Introducing the toughest tapes to ever hit a jobsite. Shockforce brings new meaning to the term high performance with a full 14 Ft. of standout and the ability to survive a 100 Ft. drop onto solid concrete. Add in a diamond coated 360-degree end hook that delivers 50% more gripping power, a two-sided blade with vertical markings on the back, and class-leading ergonomics and you have a tape that’s destined to be the new standard for trade professionals.",Introducing the toughest tapes to ever hit a jobsite. Shockforce brings new meaning to the term high performance with a full 14 Ft. of standout and the ability to survive a 100 Ft. drop onto solid concrete. Add in a diamond coated 360-degree end hook that,"Diamond-coated end hook grabs material from every direction and prevents slippage Narrow blade technology offers reduced weight when carrying a tape all day on the job site Matte black nylon blade provides extended product life and improved legibility in varied light conditions Optimized drum and spring design provides a compact case design that fits comfortably in the palm of your hand Survives a 100' drop for real life, on the job durability Dual-sided blade print with vertical quick read scale on underside for overhead and hard to reach measurements 14 feet of unassisted standout Steel tether point offers increased safety capability when working at height Steel tether point can also be used for scribing and drawing arcs during layout",3710332833.0,"1-3/16"" x 25' Shockforce Night Eye Dual Sided Tape Measure",LUFKIN L1125B 25X1-3/16 NITE EYE TAPE MEASURE BLACK BLADE
27969,Tape Measures,L1135,LUFKIN L1135 1-3/16X35 SHOCKFORCE TAPE MEASURE,,E:\IMAGES\ITEMS\product\L\1\lufkin-l1135-lufkin-l1135-1-316x35-shockforce-tape-measure.jpg,Lufkin,"Introducing the toughest tapes to ever hit a jobsite. Shockforce brings new meaning to the term high performance with a full 14 Ft. of standout and the ability to survive a 100 Ft. drop onto solid concrete. Add in a diamond coated 360-degree end hook that delivers 50% more gripping power, a two-sided blade with vertical markings on the back, and class-leading ergonomics and you have a tape that’s destined to be the new standard for trade professionals.",Introducing the toughest tapes to ever hit a jobsite. Shockforce brings new meaning to the term high performance with a full 14 Ft. of standout and the ability to survive a 100 Ft. drop onto solid concrete. Add in a diamond coated 360-degree end hook that,"Diamond-coated end hook grabs material from every direction and prevents slippage Narrow blade technology offers reduced weight when carrying a tape all day on the job site Matte nylon blade provides extended product life and glare reduction Optimized drum and spring design provides a compact case design that fits comfortably in the palm of your hand Survives a 100' drop for real life, on the job durability Dual-sided blade print with vertical quick read scale on underside for overhead and hard to reach measurements 14 feet of unassisted standout Steel tether point offers increased safety capability when working at height Steel tether point can also be used for scribing and drawing arcs during layout",3710332831.0,"1-3/16"" x 35' Shockforce Dual Sided Tape Measure",LUFKIN L1135 1-3/16X35 SHOCKFORCE TAPE MEASURE
27969,Tape Measures,L1135B,LUFKIN L1135B 35X1-3/16 NITE EYE TAPE MEASURE BLACK BLADE,,E:\IMAGES\ITEMS\product\L\1\lufkin-l1135b-lufkin-l1135b-35x1-316-nite-eye-tape-measure-black-blade.jpg,Lufkin,"Introducing the toughest tapes to ever hit a jobsite. Shockforce brings new meaning to the term high performance with a full 14 Ft. of standout and the ability to survive a 100 Ft. drop onto solid concrete. Add in a diamond coated 360-degree end hook that delivers 50% more gripping power, a two-sided blade with vertical markings on the back, and class-leading ergonomics and you have a tape that’s destined to be the new standard for trade professionals.",Introducing the toughest tapes to ever hit a jobsite. Shockforce brings new meaning to the term high performance with a full 14 Ft. of standout and the ability to survive a 100 Ft. drop onto solid concrete. Add in a diamond coated 360-degree end hook that,"Diamond-coated end hook grabs material from every direction and prevents slippage Narrow blade technology offers reduced weight when carrying a tape all day on the job site Matte black nylon blade provides extended product life and improved legibility in varied light conditions Optimized drum and spring design provides a compact case design that fits comfortably in the palm of your hand Survives a 100' drop for real life, on the job durability Dual-sided blade print with vertical quick read scale on underside for overhead and hard to reach measurements 14 feet of unassisted standout Steel tether point offers increased safety capability when working at height Steel tether point can also be used for scribing and drawing arcs during layout",3710332834.0,"1-3/16"" x 35' Shockforce Night Eye Dual Sided Tape Measure",LUFKIN L1135B 35X1-3/16 NITE EYE TAPE MEASURE BLACK BLADE
27969,Tape Measures,L625N,LUFKIN L625N 1X25 POWER TAPE MEASURE HI-VIZ ORANGE,,E:\IMAGES\ITEMS\product\L\6\lufkin-l625n-lufkin-l625n-1x25-power-tape-measure-hi-viz-orange.jpg,Lufkin,The LUFKIN L600N series tape measures feature a bright orange textured case for easier grip and increased user comfort. The blade has a matte finish which reduces glare which increases blade legibility. The blade is also nylon coated for an extended product life. The dual riveted end hook tips allow the user to mark measurements without the need for a writing utensil.,,"1"" x 25' Hi-Viz® Orange Yellow Clad Power Return Tape Measure Textured Case For Easier Grip And Increased User Comfort Nylon Coated Blade For Extended Product Life Matte Blade Finish Reduces Glare And Increased Blade Legibility Metal Mounting Post For Increased Durability And Drop Strength Serrated End Hook Tips Allow Users To Mark Measurements Without A Writing Utensil Blade Style: A5",3710324110.0,,LUFKIN L625N 1X25 POWER TAPE MEASURE HI-VIZ ORANGE
